,date,review,rating,status,length,label,language_scores,language,scores,compound,sentiment
2228,2019-07-13,Great course to get one's feet wet with the open source tools available.,5,completer,72,pos,"{'language': 'en', 'score': 0.9999983607509165}",en,"{'neg': 0.0, 'neu': 0.745, 'pos': 0.255, 'compound': 0.6249}",0.6249,pos
2229,2019-07-13,The IBM Skills Network Lab keeps disconnect and is insanely slow. It's stupid af.,5,completer,81,pos,"{'language': 'en', 'score': 0.9999987231943841}",en,"{'neg': 0.207, 'neu': 0.793, 'pos': 0.0, 'compound': -0.5267}",-0.5267,neg
2230,2019-07-12,Very useful tools!,5,completer,18,pos,"{'language': 'en', 'score': 0.9999963983742098}",en,"{'neg': 0.0, 'neu': 0.365, 'pos': 0.635, 'compound': 0.54}",0.54,pos
2231,2019-07-12,I found this course very useful. I especially enjoyed practice with new markdown tools in Jupyter which were very useful for creating well formatted notebooks.,5,completer,159,pos,"{'language': 'en', 'score': 0.9999980711969763}",en,"{'neg': 0.0, 'neu': 0.549, 'pos': 0.451, 'compound': 0.9301}",0.9301,pos
2232,2019-07-12,Lots of fun and I learned allot.,5,completer,32,pos,"{'language': 'en', 'score': 0.9999992074653096}",en,"{'neg': 0.0, 'neu': 0.602, 'pos': 0.398, 'compound': 0.5106}",0.5106,pos
2233,2019-07-12,Nice exposure to open source tools available for studying Data Science.,5,completer,71,pos,"{'language': 'en', 'score': 0.9999960099282781}",en,"{'neg': 0.0, 'neu': 0.781, 'pos': 0.219, 'compound': 0.4215}",0.4215,pos
2234,2019-07-12,Good introduction of a few open source data analytics platforms.,5,completer,64,pos,"{'language': 'en', 'score': 0.9999959116501507}",en,"{'neg': 0.0, 'neu': 0.734, 'pos': 0.266, 'compound': 0.4404}",0.4404,pos
2235,2019-07-12,"An extremely nice course, easy to understand and easy to follow video directions shared by the instructors. Ave learnt so many open source tools that I can use in various data models and how identify the best tool to use depending on dynamics of the data and tasks ahead. Kudos IBM Team",5,completer,286,pos,"{'language': 'en', 'score': 0.9999988476718066}",en,"{'neg': 0.0, 'neu': 0.673, 'pos': 0.327, 'compound': 0.9658}",0.9658,pos
2236,2019-07-12,Good overview of tools used by data scientists..,5,dropout,48,pos,"{'language': 'en', 'score': 0.9999968242720831}",en,"{'neg': 0.0, 'neu': 0.707, 'pos': 0.293, 'compound': 0.4404}",0.4404,pos
2237,2019-07-11,A little easy,4,dropout,13,pos,"{'language': 'en', 'score': 0.9999956313314193}",en,"{'neg': 0.0, 'neu': 0.277, 'pos': 0.723, 'compound': 0.3832}",0.3832,pos
2238,2019-07-11,Outstanding! I really had to dig i and pay attention to details this week,5,dropout,73,pos,"{'language': 'en', 'score': 0.9999970090647043}",en,"{'neg': 0.089, 'neu': 0.637, 'pos': 0.274, 'compound': 0.5983}",0.5983,pos
2239,2019-07-11,Thank for providing me knowledge about open source tools for data science.,5,completer,74,pos,"{'language': 'en', 'score': 0.9999974832576783}",en,"{'neg': 0.0, 'neu': 0.815, 'pos': 0.185, 'compound': 0.3612}",0.3612,pos
2240,2019-07-11,course really helped me in learning Data science tool.,5,completer,54,pos,"{'language': 'en', 'score': 0.9999969776610046}",en,"{'neg': 0.0, 'neu': 1.0, 'pos': 0.0, 'compound': 0.0}",0.0,neu
2241,2019-07-11,"I think it would be better if the course focused on one online platform such as Skills New Labs rather than learning about multiple notebooks with multiple programming language with multiple work benches. It is to some extent confusing for someone with no prior experience in working with python, scala, or R. Nonetheless, this course has allowed me to understand more about available options which could be beneficial for experts. ",3,completer,432,neu,"{'language': 'en', 'score': 0.9999966216679183}",en,"{'neg': 0.054, 'neu': 0.837, 'pos': 0.11, 'compound': 0.6486}",0.6486,pos
2242,2019-07-11,Great  with interactive handson,5,completer,31,pos,"{'language': 'en', 'score': 0.9999985173602143}",en,"{'neg': 0.0, 'neu': 0.423, 'pos': 0.577, 'compound': 0.6249}",0.6249,pos
2243,2019-07-11,Basics of Jupyter Notebook were clear but zepplelin notebook was not that much cleared,4,completer,86,pos,"{'language': 'en', 'score': 0.9999955226840915}",en,"{'neg': 0.095, 'neu': 0.787, 'pos': 0.118, 'compound': 0.0915}",0.0915,pos
2244,2019-07-11,It was fun coding Python ,4,completer,25,pos,"{'language': 'en', 'score': 0.9999984648255775}",en,"{'neg': 0.0, 'neu': 0.548, 'pos': 0.452, 'compound': 0.5106}",0.5106,pos
2245,2019-07-10,Need more exercises,4,completer,19,pos,"{'language': 'en', 'score': 0.9999937468973452}",en,"{'neg': 0.0, 'neu': 1.0, 'pos': 0.0, 'compound': 0.0}",0.0,neu
2246,2019-07-10,"This resource on open source tools on data science is good, but it's kind of outdated video. Rest all are perfect",4,completer,113,pos,"{'language': 'en', 'score': 0.9999967212578392}",en,"{'neg': 0.0, 'neu': 0.731, 'pos': 0.269, 'compound': 0.7906}",0.7906,pos
2247,2019-07-10,Maybe could incorporate Pycharm,4,completer,31,pos,"{'language': 'en', 'score': 0.9999940593734149}",en,"{'neg': 0.0, 'neu': 1.0, 'pos': 0.0, 'compound': 0.0}",0.0,neu
2248,2019-07-10,good basics concepts which can be useful to applied on future perspective data science projects.,4,dropout,96,pos,"{'language': 'en', 'score': 0.9999970434504859}",en,"{'neg': 0.0, 'neu': 0.691, 'pos': 0.309, 'compound': 0.7003}",0.7003,pos
2249,2019-07-09,IBM WATSON is not up to the mark creating account and all are very hectic otherwise course is too good,4,completer,102,pos,"{'language': 'en', 'score': 0.9999944395959361}",en,"{'neg': 0.0, 'neu': 0.779, 'pos': 0.221, 'compound': 0.6249}",0.6249,pos
2250,2019-07-09,Very good understanding of tools for data science,5,dropout,49,pos,"{'language': 'en', 'score': 0.99999515294785}",en,"{'neg': 0.0, 'neu': 0.687, 'pos': 0.313, 'compound': 0.4927}",0.4927,pos
2251,2019-07-09,I had an amazing learning ins this course,5,completer,41,pos,"{'language': 'en', 'score': 0.9999974767900344}",en,"{'neg': 0.0, 'neu': 0.612, 'pos': 0.388, 'compound': 0.5859}",0.5859,pos
2252,2019-07-08,A great little intro to get the people coding with open source tools,5,completer,68,pos,"{'language': 'en', 'score': 0.9999972438883566}",en,"{'neg': 0.0, 'neu': 0.728, 'pos': 0.272, 'compound': 0.6249}",0.6249,pos
2253,2019-07-08,Good,4,completer,4,pos,"{'language': 'so', 'score': 0.9999966216398368}",so,"{'neg': 0.0, 'neu': 0.0, 'pos': 1.0, 'compound': 0.4404}",0.4404,pos
2254,2019-07-08,Nice starting point to learn how to use a notebook in a simple manner,4,completer,69,pos,"{'language': 'en', 'score': 0.9999977294468698}",en,"{'neg': 0.0, 'neu': 0.797, 'pos': 0.203, 'compound': 0.4215}",0.4215,pos
2255,2019-07-08,Great introductory course to data science tools,5,completer,47,pos,"{'language': 'en', 'score': 0.9999941468807647}",en,"{'neg': 0.0, 'neu': 0.594, 'pos': 0.406, 'compound': 0.6249}",0.6249,pos
2256,2019-07-06,I enjoy the lectures. The professor has a good speaking and teaching style which keeps me interested. Lots of concrete math examples which make it easier to understand. Very good slides which are well formulated and easy to understand,5,completer,234,pos,"{'language': 'en', 'score': 0.999997716040883}",en,"{'neg': 0.0, 'neu': 0.606, 'pos': 0.394, 'compound': 0.9552}",0.9552,pos
2257,2019-07-06,Great course! The only negative is that the peer-reviewed assignments take more time and it might delay your course completion.,5,dropout,127,pos,"{'language': 'en', 'score': 0.9999969448210004}",en,"{'neg': 0.23, 'neu': 0.621, 'pos': 0.15, 'compound': -0.2942}",-0.2942,neg
2258,2019-07-05,Very useful intro to data science tools + lots of free stuff :) ,5,completer,64,pos,"{'language': 'en', 'score': 0.9999957010536411}",en,"{'neg': 0.0, 'neu': 0.487, 'pos': 0.513, 'compound': 0.8588}",0.8588,pos
2259,2019-07-05,Great course give overview of Open sources tools like Data Science,5,completer,66,pos,"{'language': 'en', 'score': 0.9999963997900267}",en,"{'neg': 0.0, 'neu': 0.577, 'pos': 0.423, 'compound': 0.765}",0.765,pos
2260,2019-07-05,Had problems with creating notebook on IBM watson studio and got no expert help. I had to figure it out on my own which took a lot of time.,2,completer,139,neg,"{'language': 'en', 'score': 0.9999967307497938}",en,"{'neg': 0.149, 'neu': 0.701, 'pos': 0.149, 'compound': 0.0}",0.0,neu
2261,2019-07-05,"The essence of this course can be fit into a one 10-15 mins youtube video. While the contents can be somewhat useful, the course itself is a complete waste of time and money",1,dropout,173,neg,"{'language': 'en', 'score': 0.9999986227231211}",en,"{'neg': 0.078, 'neu': 0.78, 'pos': 0.142, 'compound': 0.3197}",0.3197,pos
2262,2019-07-05,It was not very exciting,3,dropout,24,neu,"{'language': 'en', 'score': 0.999997852413995}",en,"{'neg': 0.416, 'neu': 0.584, 'pos': 0.0, 'compound': -0.43}",-0.43,neg
2263,2019-07-04,It was a pleasant journey ,5,completer,26,pos,"{'language': 'en', 'score': 0.9999980414341687}",en,"{'neg': 0.0, 'neu': 0.476, 'pos': 0.524, 'compound': 0.5106}",0.5106,pos
2264,2019-07-04,"I love the hands-on with IBM Watson and Skill Network Labs, it's really helpful without set-up my own local environment. Love it so much!!!",5,completer,139,pos,"{'language': 'en', 'score': 0.9999957264421797}",en,"{'neg': 0.0, 'neu': 0.618, 'pos': 0.382, 'compound': 0.9242}",0.9242,pos
2265,2019-07-04,Pretty boring Course. Doesnt feel I got much out of it except the knowing of the IBM Wasson platform. Hope next ones will be better!,2,dropout,132,neg,"{'language': 'en', 'score': 0.9999970612210443}",en,"{'neg': 0.073, 'neu': 0.633, 'pos': 0.294, 'compound': 0.7901}",0.7901,pos
2266,2019-07-03,Instruction Videos are outdated; a totally different format is used for some of the Open Source Tools then what is shown in the video.,3,dropout,134,neu,"{'language': 'en', 'score': 0.9999973182860071}",en,"{'neg': 0.0, 'neu': 1.0, 'pos': 0.0, 'compound': 0.0}",0.0,neu
2267,2019-07-03,Great overview and hands on of the Data Science tools.,5,dropout,54,pos,"{'language': 'en', 'score': 0.9999973641368809}",en,"{'neg': 0.0, 'neu': 0.687, 'pos': 0.313, 'compound': 0.6249}",0.6249,pos
2268,2019-07-03,It was a nice course but I also felt like I should have had some previous knowledge which was a bit confusing.,4,completer,110,pos,"{'language': 'en', 'score': 0.9999993482723172}",en,"{'neg': 0.104, 'neu': 0.667, 'pos': 0.229, 'compound': 0.4215}",0.4215,pos
2269,2019-07-03,"awesome course, great expalnations",5,dropout,34,pos,"{'language': 'en', 'score': 0.9999934960230844}",en,"{'neg': 0.0, 'neu': 0.196, 'pos': 0.804, 'compound': 0.8481}",0.8481,pos
2270,2019-07-02,Great Insight ,4,completer,14,pos,"{'language': 'en', 'score': 0.9999958143956313}",en,"{'neg': 0.0, 'neu': 0.196, 'pos': 0.804, 'compound': 0.6249}",0.6249,pos
2271,2019-07-02,Great!,5,completer,6,pos,"{'language': 'en', 'score': 0.999993205769339}",en,"{'neg': 0.0, 'neu': 0.0, 'pos': 1.0, 'compound': 0.6588}",0.6588,pos
2272,2019-07-01,Gives the idea of where to go and how to start using some tools for DS,4,completer,70,pos,"{'language': 'en', 'score': 0.9999982180203374}",en,"{'neg': 0.0, 'neu': 1.0, 'pos': 0.0, 'compound': 0.0}",0.0,neu
2273,2019-07-01,I feel I just got to try a bunch of tools out there but didn't have a clue how they could be used in the real world. I mean I certainly could look into those tutorials in the community but registering for a course is to save me some time browsing through random topics. I think the course can be a bit more structured and provide more meaningful practice opportunities. ,3,completer,370,neu,"{'language': 'en', 'score': 0.999996477211934}",en,"{'neg': 0.0, 'neu': 0.796, 'pos': 0.204, 'compound': 0.9391}",0.9391,pos
2274,2019-07-01,Great introduction to Jupyter Notebooks.,4,dropout,40,pos,"{'language': 'en', 'score': 0.999996544320595}",en,"{'neg': 0.0, 'neu': 0.494, 'pos': 0.506, 'compound': 0.6249}",0.6249,pos
2275,2019-06-30,A lot of the questions during the 'final check' are based on the content of the video and not on the general knowledge has about the topics that are described in the video. ,4,dropout,173,pos,"{'language': 'en', 'score': 0.9999967178904305}",en,"{'neg': 0.0, 'neu': 1.0, 'pos': 0.0, 'compound': 0.0}",0.0,neu
2276,2019-06-30,Good introduction to various tools available to data science novices.,4,completer,69,pos,"{'language': 'en', 'score': 0.8571384444303448}",en,"{'neg': 0.0, 'neu': 0.756, 'pos': 0.244, 'compound': 0.4404}",0.4404,pos
2277,2019-06-30,"This course is very nice to understand Python, Zappelin and R Studio basics on code and concepts, in which you will get hands on along with creating a free IBM Cloud and Watson Studio account.",5,completer,192,pos,"{'language': 'en', 'score': 0.9999977302553464}",en,"{'neg': 0.0, 'neu': 0.777, 'pos': 0.223, 'compound': 0.8221}",0.8221,pos
2278,2019-06-30,"The instructions are not very clear and also the interface for IBM Waston has changed a lot but the videos have not been updated, which caused confusions.",3,dropout,154,neu,"{'language': 'en', 'score': 0.9999964970359793}",en,"{'neg': 0.144, 'neu': 0.856, 'pos': 0.0, 'compound': -0.4679}",-0.4679,neg
2279,2019-06-30,deeply enlightening course,5,dropout,26,pos,"{'language': 'nl', 'score': 0.7142853401178408}",nl,"{'neg': 0.0, 'neu': 0.358, 'pos': 0.642, 'compound': 0.5563}",0.5563,pos
2280,2019-06-29,Here is the best practical knowledge about data science tool.,5,dropout,61,pos,"{'language': 'en', 'score': 0.9999970706215786}",en,"{'neg': 0.0, 'neu': 0.682, 'pos': 0.318, 'compound': 0.6369}",0.6369,pos
2281,2019-06-29,"This was a good course overall. The videos were helpful in showing how to navigate different notebooks and had links to other sites with further info if we needed. My only negative is that they haven't properly updated the course to match IBM Watson Studio and still have the video showing the old version. I had to spend hours on my own searching through the site to figure out how to create a project in this new format. I appreciated the promo which allowed me to access more of Watson Studio, but maybe offer more explanation on how to create projects within different versions. Otherwise, a really good course on the basics. ",4,completer,630,pos,"{'language': 'en', 'score': 0.9999974309731257}",en,"{'neg': 0.02, 'neu': 0.859, 'pos': 0.121, 'compound': 0.8658}",0.8658,pos
2282,2019-06-29,Good overview of open source tools,5,completer,34,pos,"{'language': 'en', 'score': 0.9999953702928084}",en,"{'neg': 0.0, 'neu': 0.633, 'pos': 0.367, 'compound': 0.4404}",0.4404,pos
2283,2019-06-29,Excellent,5,completer,9,pos,"{'language': 'ca', 'score': 0.9999953650428279}",ca,"{'neg': 0.0, 'neu': 0.0, 'pos': 1.0, 'compound': 0.5719}",0.5719,pos
2284,2019-06-28,Amazing,5,completer,7,pos,"{'language': 'sw', 'score': 0.9999969419525567}",sw,"{'neg': 0.0, 'neu': 0.0, 'pos': 1.0, 'compound': 0.5859}",0.5859,pos
2285,2019-06-28,"Thanks for this class, I learn a lot about ""Skills Network Labs"" and "" IBM Data Science Experience"". However, the version of tools and website page used in this video should be updated cause there are many differences from the real website and the website showed in video. This might make people confused.",4,dropout,305,pos,"{'language': 'en', 'score': 0.9999945489031477}",en,"{'neg': 0.043, 'neu': 0.902, 'pos': 0.055, 'compound': 0.1531}",0.1531,pos
2286,2019-06-28,the material needs to be updated,4,dropout,32,pos,"{'language': 'en', 'score': 0.9999968961347416}",en,"{'neg': 0.0, 'neu': 1.0, 'pos': 0.0, 'compound': 0.0}",0.0,neu
2287,2019-06-28,So well explained and presented that an absolute beginner can grasp all the details...,5,dropout,86,pos,"{'language': 'en', 'score': 0.9999969380205292}",en,"{'neg': 0.0, 'neu': 0.845, 'pos': 0.155, 'compound': 0.3384}",0.3384,pos
2288,2019-06-28,"good intro to very very surface essentials of watson, zeppelin, jupyter, rstudio. though i didn't like the relatively extensive reading. video tutorials would be easier to follow cos a pic speaks a thousand words! but tqvm for this course!!!!",5,completer,242,pos,"{'language': 'en', 'score': 0.9999967868226686}",en,"{'neg': 0.039, 'neu': 0.834, 'pos': 0.127, 'compound': 0.5366}",0.5366,pos
2289,2019-06-28,Essentials covered,5,dropout,18,pos,"{'language': 'ca', 'score': 0.9999983354147999}",ca,"{'neg': 0.0, 'neu': 1.0, 'pos': 0.0, 'compound': 0.0}",0.0,neu
2290,2019-06-28,perfectly explained ,5,completer,20,pos,"{'language': 'en', 'score': 0.9999950835583225}",en,"{'neg': 0.0, 'neu': 0.192, 'pos': 0.808, 'compound': 0.6369}",0.6369,pos
2291,2019-06-27,Wish the course was updated for Watson Studio instead of the previous version,3,dropout,77,neu,"{'language': 'en', 'score': 0.9999976561027454}",en,"{'neg': 0.0, 'neu': 0.816, 'pos': 0.184, 'compound': 0.4019}",0.4019,pos
2292,2019-06-27,Great Introduction to various tools. Very suitable for someone who is just starting out.,4,completer,88,pos,"{'language': 'en', 'score': 0.9999970150645476}",en,"{'neg': 0.0, 'neu': 0.76, 'pos': 0.24, 'compound': 0.6249}",0.6249,pos
2293,2019-06-26,The only reason I gave this only 3 stars is because the Week 3 videos did not match up to the content instruction. This made it difficult and confusing.  Not sure when it will be fixed.,3,completer,185,neu,"{'language': 'en', 'score': 0.9999976069788006}",en,"{'neg': 0.175, 'neu': 0.825, 'pos': 0.0, 'compound': -0.6555}",-0.6555,neg
2294,2019-06-26,"A little bit too easy, but still, maybe good for beginners.",3,completer,59,neu,"{'language': 'en', 'score': 0.9999978677442446}",en,"{'neg': 0.0, 'neu': 0.585, 'pos': 0.415, 'compound': 0.6876}",0.6876,pos
2295,2019-06-26,"Course content was good, but IBM watson contents need to be updated and lots of issues while creating project. hopefully it gets resolved for other students",5,completer,156,pos,"{'language': 'en', 'score': 0.9999967578588855}",en,"{'neg': 0.0, 'neu': 0.68, 'pos': 0.32, 'compound': 0.8537}",0.8537,pos
2296,2019-06-26,It Explains all the different open source tools which we can use to explore in Data Science Technology ,5,completer,103,pos,"{'language': 'en', 'score': 0.9999956552686754}",en,"{'neg': 0.0, 'neu': 1.0, 'pos': 0.0, 'compound': 0.0}",0.0,neu
2297,2019-06-25,"The only objective of this course is to push IBM Cloud and Watson Studio on the learners. The software is highly dysfunctional and user unfriendly. I can't submit my assignment due to unclear instructions and errors that come up when I try to do so. This is so far the worst part of this whole course. I have found a forum link with some troubleshooting which I have fruitlessly searched for an answer, maybe somebody will find something there: https://www.coursera.org/learn/open-source-tools-for-data-science/peer/xakrA/create-and-share-your-jupyter-notebook/discussions/threads/G7ITBorwEem4khKVBn768g",1,dropout,603,neg,"{'language': 'en', 'score': 0.9999984065496377}",en,"{'neg': 0.136, 'neu': 0.844, 'pos': 0.02, 'compound': -0.8612}",-0.8612,neg
2298,2019-06-25,"This course is very beneficial for beginners. As the instructor teach you how to use Data science tool such as Jupyter Notebook, Zeepline Notebook, R Studio etc.One thing i fill that the teaching sense is not that good for beginners. ",4,dropout,234,pos,"{'language': 'en', 'score': 0.9999980045446374}",en,"{'neg': 0.058, 'neu': 0.865, 'pos': 0.077, 'compound': 0.1991}",0.1991,pos
2299,2019-06-25,A great course on open source tools available on IBM platform.,5,dropout,62,pos,"{'language': 'en', 'score': 0.999996560655544}",en,"{'neg': 0.0, 'neu': 0.687, 'pos': 0.313, 'compound': 0.6249}",0.6249,pos
2300,2019-06-25,instructor is very good. Explaining all the concepts very clearly and pace of course is also good.,5,completer,98,pos,"{'language': 'en', 'score': 0.9999960078700425}",en,"{'neg': 0.0, 'neu': 0.599, 'pos': 0.401, 'compound': 0.8548}",0.8548,pos
2301,2019-06-25,Super Tools and Techniques and Cloud Infrastructure is good. IBM watson Studio is beautifull ,5,completer,93,pos,"{'language': 'en', 'score': 0.9999944532462242}",en,"{'neg': 0.0, 'neu': 0.638, 'pos': 0.362, 'compound': 0.7783}",0.7783,pos
2302,2019-06-25,Relatively easy to understand.,4,completer,30,pos,"{'language': 'en', 'score': 0.999995942206285}",en,"{'neg': 0.0, 'neu': 0.508, 'pos': 0.492, 'compound': 0.4404}",0.4404,pos
2303,2019-06-25,The IBM platform website looks to be updated. it would help if the videos were also updated so there is less confusion for students when they try sign up for an IBM account. Looks like a few students had issues from the discussion forums.,2,completer,238,neg,"{'language': 'en', 'score': 0.9999960106647887}",en,"{'neg': 0.04, 'neu': 0.849, 'pos': 0.11, 'compound': 0.5095}",0.5095,pos
2304,2019-06-24,powerful tool and ease to use.,5,completer,30,pos,"{'language': 'en', 'score': 0.9999954772624258}",en,"{'neg': 0.0, 'neu': 0.43, 'pos': 0.57, 'compound': 0.6486}",0.6486,pos
2305,2019-06-24,This course gives us an overview of all the open source tools available.,5,completer,72,pos,"{'language': 'en', 'score': 0.9999963459905015}",en,"{'neg': 0.0, 'neu': 1.0, 'pos': 0.0, 'compound': 0.0}",0.0,neu
2306,2019-06-24,Please Update Watson videovery old links and informationthe reward link for 6 month promo does not work,2,completer,103,neg,"{'language': 'en', 'score': 0.9999963674232316}",en,"{'neg': 0.0, 'neu': 0.7, 'pos': 0.3, 'compound': 0.7184}",0.7184,pos
2307,2019-06-24,"Though slightly technical for beginners, considering the learning required to complete the course, it is really good.",5,completer,117,pos,"{'language': 'en', 'score': 0.9999972341947818}",en,"{'neg': 0.0, 'neu': 0.834, 'pos': 0.166, 'compound': 0.4927}",0.4927,pos
2308,2019-06-24,Some of the lectures need to be updated. ,4,completer,41,pos,"{'language': 'en', 'score': 0.9999955351033353}",en,"{'neg': 0.0, 'neu': 1.0, 'pos': 0.0, 'compound': 0.0}",0.0,neu
2309,2019-06-24,GREAT,5,completer,5,pos,"{'language': 'de', 'score': 0.9999939773342119}",de,"{'neg': 0.0, 'neu': 0.0, 'pos': 1.0, 'compound': 0.6249}",0.6249,pos
2310,2019-06-24,It is must have for a newbie in Data Science. Thank you.,5,completer,56,pos,"{'language': 'en', 'score': 0.9999952030744009}",en,"{'neg': 0.0, 'neu': 0.8, 'pos': 0.2, 'compound': 0.3612}",0.3612,pos
2311,2019-06-24,"Very basic. The IBM cloud advertisements make it feel more like a product endorsement than a real course, at times.",3,dropout,115,neu,"{'language': 'en', 'score': 0.9999952897138259}",en,"{'neg': 0.0, 'neu': 0.749, 'pos': 0.251, 'compound': 0.6549}",0.6549,pos
2312,2019-06-24,Good course,5,dropout,11,pos,"{'language': 'en', 'score': 0.9999959130625047}",en,"{'neg': 0.0, 'neu': 0.256, 'pos': 0.744, 'compound': 0.4404}",0.4404,pos
2313,2019-06-24,This course needs update. The current IBM environment and Tutorial examples are not matching and confusing. It also leads to crate multiple account with IBM. Otherwise good intro to the tools and environments. ,3,dropout,210,neu,"{'language': 'en', 'score': 0.999996130326628}",en,"{'neg': 0.0, 'neu': 0.872, 'pos': 0.128, 'compound': 0.5523}",0.5523,pos
2314,2019-06-23,Nice brief overview of ibm opensource tools available,5,completer,53,pos,"{'language': 'en', 'score': 0.9999961150603083}",en,"{'neg': 0.0, 'neu': 0.714, 'pos': 0.286, 'compound': 0.4215}",0.4215,pos
2315,2019-06-23,Excellentcourse,5,completer,15,pos,"{'language': 'fr', 'score': 0.9999961817957808}",fr,"{'neg': 0.0, 'neu': 1.0, 'pos': 0.0, 'compound': 0.0}",0.0,neu
2316,2019-06-23,Good entry level review of available DS tools,5,completer,45,pos,"{'language': 'en', 'score': 0.9999960376548545}",en,"{'neg': 0.0, 'neu': 0.707, 'pos': 0.293, 'compound': 0.4404}",0.4404,pos
2317,2019-06-21,Best course ever!,5,dropout,17,pos,"{'language': 'fr', 'score': 0.9999953252142679}",fr,"{'neg': 0.0, 'neu': 0.308, 'pos': 0.692, 'compound': 0.6696}",0.6696,pos
2318,2019-06-21,good preview,5,dropout,12,pos,"{'language': 'af', 'score': 0.9999937782778672}",af,"{'neg': 0.0, 'neu': 0.256, 'pos': 0.744, 'compound': 0.4404}",0.4404,pos
2319,2019-06-21,This is an excellent and engaging course.,5,completer,41,pos,"{'language': 'en', 'score': 0.9999934084587221}",en,"{'neg': 0.0, 'neu': 0.45, 'pos': 0.55, 'compound': 0.7269}",0.7269,pos
2320,2019-06-21,The course was good but can be more detailed.,4,completer,45,pos,"{'language': 'en', 'score': 0.9999939875987567}",en,"{'neg': 0.0, 'neu': 0.804, 'pos': 0.196, 'compound': 0.2382}",0.2382,pos
2321,2019-06-21,We need some more practice course on Jypter notebook.,5,completer,53,pos,"{'language': 'en', 'score': 0.9999942184218473}",en,"{'neg': 0.0, 'neu': 1.0, 'pos': 0.0, 'compound': 0.0}",0.0,neu
2322,2019-06-21,This is really a well-organized course. Data science aspirant should enroll in this course.,5,completer,91,pos,"{'language': 'en', 'score': 0.9999964900880018}",en,"{'neg': 0.0, 'neu': 1.0, 'pos': 0.0, 'compound': 0.0}",0.0,neu
2323,2019-06-20,Very general information,4,completer,24,pos,"{'language': 'en', 'score': 0.9999936419680449}",en,"{'neg': 0.0, 'neu': 1.0, 'pos': 0.0, 'compound': 0.0}",0.0,neu
2324,2019-06-20,There is a discrepancy in one of the sections due to older versions. Not too major though.,4,completer,90,pos,"{'language': 'en', 'score': 0.9999971741344131}",en,"{'neg': 0.0, 'neu': 1.0, 'pos': 0.0, 'compound': 0.0}",0.0,neu
2325,2019-06-20,"The video lectures are outdated and are in dire need of updates. I found myself lost at times, as the current version of Watson does not match the version shown in the lectures. It was a bit frustrating. ",3,completer,204,neu,"{'language': 'en', 'score': 0.9999958556753877}",en,"{'neg': 0.199, 'neu': 0.801, 'pos': 0.0, 'compound': -0.802}",-0.802,neg
2326,2019-06-20,Excellent instructor.,5,completer,21,pos,"{'language': 'ca', 'score': 0.7160395921398037}",ca,"{'neg': 0.0, 'neu': 0.213, 'pos': 0.787, 'compound': 0.5719}",0.5719,pos
2327,2019-06-20,videos need to be updated,3,completer,25,neu,"{'language': 'en', 'score': 0.8571417418431516}",en,"{'neg': 0.0, 'neu': 1.0, 'pos': 0.0, 'compound': 0.0}",0.0,neu
