,date,review,rating,status,length,label,language_scores,language,scores,compound,sentiment
640,2020-06-15,"The course was overall OK. Several lessons were either too advanced and required previous knowledge about the subject or the audio was terrible. Nonetheless, one learns a few things in this course. But definitely not one of the best.",3,completer,233,neu,"{'language': 'en', 'score': 0.999997334210742}",en,"{'neg': 0.065, 'neu': 0.688, 'pos': 0.247, 'compound': 0.8286}",0.8286,pos
641,2020-06-15,"The course wasn't that bad. The only problem was that it was quite dry. Even with the practical labs, I didn't really have THAT much fun. As for what I learned, the course is basically there to give you an idea of the different Data Science tools that are used throughout the world today, and I like that just because this course is offered by IBM, they still didn't only tell us about tools created by them, but also open source tools and even commercial tools made by other companies.",3,completer,486,neu,"{'language': 'en', 'score': 0.9999985186990299}",en,"{'neg': 0.02, 'neu': 0.899, 'pos': 0.08, 'compound': 0.5385}",0.5385,pos
642,2020-06-15,I learned a lot in this course and it was definitely worthwhile overall. A heads-up though: the explanation videos for using GitHub are not good. It is better to research how to do that on your own. And once again the quizzes are a bit of a waste of time and the course would be better without them.,4,completer,299,pos,"{'language': 'en', 'score': 0.9999982336024016}",en,"{'neg': 0.082, 'neu': 0.745, 'pos': 0.173, 'compound': 0.6902}",0.6902,pos
643,2020-06-14,"GREAT LEARNING,",5,completer,15,pos,"{'language': 'de', 'score': 0.9999944380228873}",de,"{'neg': 0.0, 'neu': 0.196, 'pos': 0.804, 'compound': 0.6249}",0.6249,pos
644,2020-06-13,"The videos about GitHub were lack of pedagogy. fast, not clear and the subtitles in most of the cases did not match.",1,completer,116,neg,"{'language': 'en', 'score': 0.9999971421316964}",en,"{'neg': 0.183, 'neu': 0.817, 'pos': 0.0, 'compound': -0.5399}",-0.5399,neg
645,2020-06-13,The lab design needs updates,4,completer,28,pos,"{'language': 'en', 'score': 0.9999966190092673}",en,"{'neg': 0.0, 'neu': 1.0, 'pos': 0.0, 'compound': 0.0}",0.0,neu
646,2020-06-11,"This is supposed to be a beginner level course. In the introduction, it was clearly mentioned by you that no-prerequisite knowledge is necessary. This course was taught to us as if we are already some professionals in this field. A majority of the explanations went above my head. Also while demonstrating the registration to the tools, please ensure you update your course. The current version we are using and the version of the tool at the time of recording are quite different. You need to literally scratch your head in trying to understand. For example, while using the Python environment in Jupyter notebook in Watson studio, your tutorial clearly shows us to select the Free version of the tool. But when I tried, there was no free version of the tool at all. I was given 50 units of asset after which I would be charged. Please upgrade your tutorial. By looking at this course, I am not sure if you would focus on one tool at a time. Assimilating this much information for a beginner level learner is something un-comprehendable.",2,dropout,1038,neg,"{'language': 'en', 'score': 0.9999956985850026}",en,"{'neg': 0.031, 'neu': 0.854, 'pos': 0.114, 'compound': 0.9407}",0.9407,pos
647,2020-06-11,"The videos and explanations are not great If you are a beginner, do not take this course.",1,dropout,89,neg,"{'language': 'en', 'score': 0.9999977380525168}",en,"{'neg': 0.18, 'neu': 0.82, 'pos': 0.0, 'compound': -0.5096}",-0.5096,neg
648,2020-06-11,"The open source part was great; wish it had more! It feels a little vendor lockin-ny but that was to be expected. The exercises are great. I think adding a few more screenshots, a bit of proofreading, and ensuring the  OS being used by the instructor is mentioned  in the Git section will make it a little less challenging for people not familiar with either*NIX platforms. That being said, it was a GREAT introduction to the tools used for data science.",4,completer,454,pos,"{'language': 'en', 'score': 0.9999962623844346}",en,"{'neg': 0.0, 'neu': 0.769, 'pos': 0.231, 'compound': 0.9674}",0.9674,pos
649,2020-06-11,"The content is very good, a lot of ground is covered in a short space of time.  However, a few technical issues prevent 5 stars.  The audio quality in some of the videos is awful, as if they were recorded underwater. Also, some of the video notations are missing completely or have no punctuation.",4,completer,297,pos,"{'language': 'en', 'score': 0.999997432318057}",en,"{'neg': 0.135, 'neu': 0.79, 'pos': 0.075, 'compound': -0.5221}",-0.5221,neg
650,2020-06-10,"It's terrible, useless and boring",1,completer,33,neg,"{'language': 'en', 'score': 0.9999951226209993}",en,"{'neg': 0.804, 'neu': 0.196, 'pos': 0.0, 'compound': -0.802}",-0.802,neg
651,2020-06-10,"The course is nicely packed. The point i would like to highlight is the 'other Tools part'. The concepts are ok but for a newbie it is not that upto the mark. like the SPSS , it will take time for a newbie to digest.",4,completer,216,pos,"{'language': 'en', 'score': 0.9999979557136457}",en,"{'neg': 0.0, 'neu': 0.778, 'pos': 0.222, 'compound': 0.8047}",0.8047,pos
652,2020-06-10,This actually helps me since I have no background regarding the tools needed for development in Data Science. Week 1 and 2 are particularly helpful since it introduces a lot of tools that one could use. Week 3 is a bit promotional and week 4 is true challenge. The course really guides you on how to start jupyter notebook.,5,completer,323,pos,"{'language': 'en', 'score': 0.9999969628642432}",en,"{'neg': 0.037, 'neu': 0.797, 'pos': 0.166, 'compound': 0.7645}",0.7645,pos
653,2020-06-10,"Some parts of this course could be better organized to help learners. For example, the GitHub exercise in terminal should have previous concepts about using terminal in Linux, like how to create a directory or how to navigate. ",4,completer,227,pos,"{'language': 'en', 'score': 0.9999975593311371}",en,"{'neg': 0.0, 'neu': 0.764, 'pos': 0.236, 'compound': 0.8481}",0.8481,pos
654,2020-06-10,"Needs to update the Watson Studio screens, some paths don't match with the course content",3,completer,89,neu,"{'language': 'en', 'score': 0.9999966624357246}",en,"{'neg': 0.0, 'neu': 1.0, 'pos': 0.0, 'compound': 0.0}",0.0,neu
655,2020-06-10,The basic's elements for the beginners. I learned a lot,5,completer,55,pos,"{'language': 'en', 'score': 0.9999989075139387}",en,"{'neg': 0.0, 'neu': 1.0, 'pos': 0.0, 'compound': 0.0}",0.0,neu
656,2020-06-10,excellent ,5,completer,10,pos,"{'language': 'ca', 'score': 0.8127047768716187}",ca,"{'neg': 0.0, 'neu': 0.0, 'pos': 1.0, 'compound': 0.5719}",0.5719,pos
657,2020-06-10,"This course is really disappointing. This was supposed to be a beginner level but it is not actually. Someone has to have a clear knowledge about Python, RStudio, machine learning, AI etc beforehead to actually understand this course. I continued for 2 weeks the gave up because it is not worth it!Really did not expect this from platform like coursera and IBM.",1,dropout,361,neg,"{'language': 'en', 'score': 0.9999976066690319}",en,"{'neg': 0.065, 'neu': 0.828, 'pos': 0.106, 'compound': 0.5714}",0.5714,pos
658,2020-06-09,This was a fantastic course. I managed to learn a vast set of skills in both Skills Network Lab and IBM Watson studio. I recommend Coursera to all of my friends and Family.,5,completer,172,pos,"{'language': 'en', 'score': 0.9999963896748352}",en,"{'neg': 0.0, 'neu': 0.739, 'pos': 0.261, 'compound': 0.8481}",0.8481,pos
659,2020-06-09,The course is amazing for beginners as well as for professionals for building the concepts. I am really thankful to all the instructors for delivering the concepts very clearly. I recommend this course to everyone who wants to learn the different tools to build their foundation in Data Science.,5,completer,295,pos,"{'language': 'en', 'score': 0.9999974097798672}",en,"{'neg': 0.0, 'neu': 0.728, 'pos': 0.272, 'compound': 0.9399}",0.9399,pos
660,2020-06-09,Interesting Course!,5,completer,19,pos,"{'language': 'en', 'score': 0.9999963327466295}",en,"{'neg': 0.0, 'neu': 0.251, 'pos': 0.749, 'compound': 0.4574}",0.4574,pos
661,2020-06-08,Really bad narration as well as unclear instruction. This course makes me rethink if I should continue.,1,dropout,103,neg,"{'language': 'en', 'score': 0.9999970403007051}",en,"{'neg': 0.277, 'neu': 0.622, 'pos': 0.101, 'compound': -0.5709}",-0.5709,neg
662,2020-06-08,"Good review--I enjoyed coming up to speed quickly withe IDE for Jupyter notebook using Python. So much easier to debug code based on the ""cell-structure""",4,completer,153,pos,"{'language': 'en', 'score': 0.9999956596735238}",en,"{'neg': 0.0, 'neu': 0.703, 'pos': 0.297, 'compound': 0.8511}",0.8511,pos
663,2020-06-08,nice,5,completer,4,pos,"{'language': 'pl', 'score': 0.9999959044175755}",pl,"{'neg': 0.0, 'neu': 0.0, 'pos': 1.0, 'compound': 0.4215}",0.4215,pos
664,2020-06-08,Gives a overall image of Data science tools ,5,completer,44,pos,"{'language': 'en', 'score': 0.999997684256312}",en,"{'neg': 0.0, 'neu': 1.0, 'pos': 0.0, 'compound': 0.0}",0.0,neu
665,2020-06-08,Great course! Thank you Coursera :),5,completer,35,pos,"{'language': 'en', 'score': 0.9999956020282211}",en,"{'neg': 0.0, 'neu': 0.233, 'pos': 0.767, 'compound': 0.8718}",0.8718,pos
666,2020-06-08,Very easy introduction into data science concepts and tools.  Video production and materials are top-notch and easy to digest.  ,5,completer,128,pos,"{'language': 'en', 'score': 0.9999956771948566}",en,"{'neg': 0.0, 'neu': 0.727, 'pos': 0.273, 'compound': 0.7496}",0.7496,pos
667,2020-06-07,Nice course,5,completer,11,pos,"{'language': 'fr', 'score': 0.9999944194635768}",fr,"{'neg': 0.0, 'neu': 0.263, 'pos': 0.737, 'compound': 0.4215}",0.4215,pos
668,2020-06-07,Very detailed explanation about the tools that we use in Data Science. ,5,completer,71,pos,"{'language': 'en', 'score': 0.9999965936896072}",en,"{'neg': 0.0, 'neu': 1.0, 'pos': 0.0, 'compound': 0.0}",0.0,neu
669,2020-06-06,Great learning,5,completer,14,pos,"{'language': 'en', 'score': 0.9999936628963604}",en,"{'neg': 0.0, 'neu': 0.196, 'pos': 0.804, 'compound': 0.6249}",0.6249,pos
670,2020-06-06,Should contain more reading material.,3,completer,37,neu,"{'language': 'en', 'score': 0.9999953453910015}",en,"{'neg': 0.0, 'neu': 1.0, 'pos': 0.0, 'compound': 0.0}",0.0,neu
671,2020-06-05,Nice course .,5,completer,13,pos,"{'language': 'fr', 'score': 0.999995608166852}",fr,"{'neg': 0.0, 'neu': 0.263, 'pos': 0.737, 'compound': 0.4215}",0.4215,pos
672,2020-06-05,GREATTTTTT..!!!!!!,5,completer,18,pos,"{'language': 'de', 'score': 0.7142818521323916}",de,"{'neg': 0.0, 'neu': 1.0, 'pos': 0.0, 'compound': 0.0}",0.0,neu
673,2020-06-05,Excellent Course,5,completer,16,pos,"{'language': 'fr', 'score': 0.9999962284034305}",fr,"{'neg': 0.0, 'neu': 0.213, 'pos': 0.787, 'compound': 0.5719}",0.5719,pos
674,2020-06-05,"The course content is very useful, very practical.",5,completer,50,pos,"{'language': 'en', 'score': 0.9999969901033328}",en,"{'neg': 0.0, 'neu': 0.687, 'pos': 0.313, 'compound': 0.4927}",0.4927,pos
675,2020-06-05,"During the final portion of this course, it got confusing and their was no one to help.  I stumbled throw this course.  Even when I tried to email or text or go to the discussion page, no one to help me.  I am not sure I want to go any further using your course.  I guess it's like the old saying ""You get what you pay for"".  ",1,completer,326,neg,"{'language': 'en', 'score': 0.9999941591293331}",en,"{'neg': 0.152, 'neu': 0.738, 'pos': 0.11, 'compound': 0.0041}",0.0041,pos
676,2020-06-05,"I have coding experience for more than 6 years in my field and I do have a Ph.D.; I do not mean that I am smart, I just mean I am used to learning on myself as well as teaching programming (Java) to beginners! The course, tools for data science, seems there is no thinking in the teaching material! what a beginner level means and what are the teaching tools and requirement are! Directly to a terminal in Linux and start doing things that definitely need an intro and some pre actions! What a waste of time! If there was a zero star, I could give one!",1,dropout,552,neg,"{'language': 'en', 'score': 0.9999974408543042}",en,"{'neg': 0.049, 'neu': 0.867, 'pos': 0.084, 'compound': 0.5673}",0.5673,pos
677,2020-06-04,This course is well delivered.,4,completer,30,pos,"{'language': 'en', 'score': 0.9999979692835828}",en,"{'neg': 0.0, 'neu': 0.656, 'pos': 0.344, 'compound': 0.2732}",0.2732,pos
678,2020-06-04,Very bad,1,dropout,8,neg,"{'language': 'en', 'score': 0.857139933612181}",en,"{'neg': 0.791, 'neu': 0.209, 'pos': 0.0, 'compound': -0.5849}",-0.5849,neg
679,2020-06-04,The instructions are a bit complicated for the rookies. Could be a little slower and simpler. Great work otherwise,4,completer,114,pos,"{'language': 'en', 'score': 0.9999978098940843}",en,"{'neg': 0.0, 'neu': 0.796, 'pos': 0.204, 'compound': 0.6249}",0.6249,pos
680,2020-06-04,"The Tools which were mentioned in the course are really helpful and important.Through this course, you can get to know about various tools used in Data Science with their use and explanation. I really liked this course.",5,completer,219,pos,"{'language': 'en', 'score': 0.9999964275846294}",en,"{'neg': 0.0, 'neu': 0.846, 'pos': 0.154, 'compound': 0.734}",0.734,pos
681,2020-06-04,"It's a good overview of all the tools that can be used for data science. If you're following along with the IBM course, it gives you a good idea of what you could be using for your capstone class. They do not detail much of tools rather introduce them to you. It'd be up to you to delve deeper if you'd like. ",5,completer,309,pos,"{'language': 'en', 'score': 0.9999970026453227}",en,"{'neg': 0.0, 'neu': 0.873, 'pos': 0.127, 'compound': 0.8074}",0.8074,pos
682,2020-06-03,Very insightful and easy to understand. Highly recommended!!,5,completer,60,pos,"{'language': 'en', 'score': 0.9999965736395378}",en,"{'neg': 0.0, 'neu': 0.507, 'pos': 0.493, 'compound': 0.7041}",0.7041,pos
683,2020-06-02,excellent,5,completer,9,pos,"{'language': 'ca', 'score': 0.9999949224132532}",ca,"{'neg': 0.0, 'neu': 0.0, 'pos': 1.0, 'compound': 0.5719}",0.5719,pos
684,2020-06-02,"Very nice approach short videos , hands on practice of tools ",5,completer,61,pos,"{'language': 'en', 'score': 0.999997015932236}",en,"{'neg': 0.0, 'neu': 0.744, 'pos': 0.256, 'compound': 0.4754}",0.4754,pos
685,2020-06-01,Best Experience Ever ,3,completer,21,neu,"{'language': 'fr', 'score': 0.5714273795556865}",fr,"{'neg': 0.0, 'neu': 0.323, 'pos': 0.677, 'compound': 0.6369}",0.6369,pos
686,2020-06-01,nice platform to learn,5,completer,22,pos,"{'language': 'en', 'score': 0.9999958635463824}",en,"{'neg': 0.0, 'neu': 0.517, 'pos': 0.483, 'compound': 0.4215}",0.4215,pos
687,2020-06-01,"It feels superficial, and I felt lost trying to do the assignments, as if I didn't have enough information to use the notebooks.  I did a lot of outside Googling.  If the purpose of the course was just to give a glimpse of what Data Scientists use, it did what it intended.  But the experience was difficult, because I constantly felt I was expected to be able to do things that I hadn't been given the tools to do.",3,completer,415,neu,"{'language': 'en', 'score': 0.9999972732539576}",en,"{'neg': 0.065, 'neu': 0.935, 'pos': 0.0, 'compound': -0.5859}",-0.5859,neg
688,2020-05-31,Informative,5,completer,11,pos,"{'language': 'en', 'score': 0.9999964876077565}",en,"{'neg': 0.0, 'neu': 1.0, 'pos': 0.0, 'compound': 0.0}",0.0,neu
689,2020-05-31,Good Course t know about the Data Science Tools,5,completer,47,pos,"{'language': 'en', 'score': 0.9999967021882352}",en,"{'neg': 0.0, 'neu': 0.707, 'pos': 0.293, 'compound': 0.4404}",0.4404,pos
690,2020-05-31,The explanations were not beginner level. Most of the things sounded Greek and Latin. ,3,dropout,86,neu,"{'language': 'en', 'score': 0.9999950528654733}",en,"{'neg': 0.0, 'neu': 1.0, 'pos': 0.0, 'compound': 0.0}",0.0,neu
691,2020-05-31,"week 2 was very unstructured and difficult to follow, refer to feedback given.",3,completer,78,neu,"{'language': 'en', 'score': 0.9999977493215952}",en,"{'neg': 0.201, 'neu': 0.799, 'pos': 0.0, 'compound': -0.4144}",-0.4144,neg
692,2020-05-31,"In my opinion, material from week 2 needs a revision",4,completer,52,pos,"{'language': 'en', 'score': 0.9999964011627466}",en,"{'neg': 0.0, 'neu': 1.0, 'pos': 0.0, 'compound': 0.0}",0.0,neu
693,2020-05-31,Its a good platform to learn new things,4,completer,39,pos,"{'language': 'en', 'score': 0.9999963634345828}",en,"{'neg': 0.0, 'neu': 0.674, 'pos': 0.326, 'compound': 0.4404}",0.4404,pos
694,2020-05-30,I had some difficulty to use IBM watson studio the first time. The video lessons are not updated,4,completer,96,pos,"{'language': 'en', 'score': 0.9999956696519892}",en,"{'neg': 0.13, 'neu': 0.87, 'pos': 0.0, 'compound': -0.34}",-0.34,neg
695,2020-05-30,"Overall, a good and useful course! Some things were a bit confusing, as if the course forgot about the previous videos",4,completer,118,pos,"{'language': 'en', 'score': 0.9999975419764316}",en,"{'neg': 0.079, 'neu': 0.667, 'pos': 0.254, 'compound': 0.636}",0.636,pos
696,2020-05-30,Nice Course,5,completer,11,pos,"{'language': 'fr', 'score': 0.9999932736341074}",fr,"{'neg': 0.0, 'neu': 0.263, 'pos': 0.737, 'compound': 0.4215}",0.4215,pos
697,2020-05-30,"Good Day
I am personally thankful and grateful for this opportunity  .Thanks and Warm Regards.ABHIJIT SENGUPTAPortfolio URL : https://about.me/abhijitsenguptaWebsite : www.pactolianconsulting.comE - Mail : abhijit@pactolianconsulting.comKolkata , IndiaSkype : abhijit.sengupta357
Ph. : + 91 33 25907110
Cell : + 91 9163863607
Whatsapp : + 91 8017648297
                      + 91 6290750012",5,completer,390,pos,"{'language': 'en', 'score': 0.9999952613081599}",en,"{'neg': 0.0, 'neu': 0.619, 'pos': 0.381, 'compound': 0.9451}",0.9451,pos
698,2020-05-30,Thanks,4,completer,6,pos,"{'language': 'en', 'score': 0.8571394329567665}",en,"{'neg': 0.0, 'neu': 0.0, 'pos': 1.0, 'compound': 0.4404}",0.4404,pos
699,2020-05-30,"Wonderful, enjoy learning this course. It helps a lot with overview and easy to understand materials",5,completer,100,pos,"{'language': 'en', 'score': 0.9999978362817373}",en,"{'neg': 0.0, 'neu': 0.47, 'pos': 0.53, 'compound': 0.9081}",0.9081,pos
700,2020-05-30,The videos introducing you to new tools like Jupyter and Github are SO BAD that it is basically just a man recording his own screen and rambling without a script. The video was not educational and not formal. It is worse than free Youtube videos that show you the exact same things. ,2,dropout,283,neg,"{'language': 'en', 'score': 0.9999979235608595}",en,"{'neg': 0.139, 'neu': 0.765, 'pos': 0.096, 'compound': -0.5513}",-0.5513,neg
701,2020-05-29,You could focus more in R,4,completer,25,pos,"{'language': 'en', 'score': 0.9999935018815506}",en,"{'neg': 0.0, 'neu': 1.0, 'pos': 0.0, 'compound': 0.0}",0.0,neu
702,2020-05-29,The content for Data Refinery could be improved a bit.,4,completer,54,pos,"{'language': 'en', 'score': 0.9999965963680064}",en,"{'neg': 0.0, 'neu': 0.721, 'pos': 0.279, 'compound': 0.4767}",0.4767,pos
703,2020-05-29,I learnt a lot in this course. It's worth it. Thank you.,5,completer,56,pos,"{'language': 'en', 'score': 0.9999976459106269}",en,"{'neg': 0.0, 'neu': 0.645, 'pos': 0.355, 'compound': 0.5267}",0.5267,pos
704,2020-05-29,"I hate to give this comment. Poor quality videos and study material. Not simply it misstated the fact that this is a Beginner course, there is also lack of effort in each of the videos made, making beginner very difficult to follow due to frequent switch of screens, making corrections in the video... The Reading/Lab section is also not helpful in terms of giving clear instructions. I only understood 10% of the materials from this course and learned everything else by myself on Youtube and other sources. The videos definitely need to be remade.",1,dropout,549,neg,"{'language': 'en', 'score': 0.9999991529295246}",en,"{'neg': 0.136, 'neu': 0.791, 'pos': 0.073, 'compound': -0.7597}",-0.7597,neg
705,2020-05-28,Nice course! This course gives good knowledge to potentially use some powerful tools in Data Science. ,5,completer,102,pos,"{'language': 'en', 'score': 0.9999962060152443}",en,"{'neg': 0.0, 'neu': 0.597, 'pos': 0.403, 'compound': 0.8313}",0.8313,pos
706,2020-05-28,The lectures are outdated with example .I would suggest reviewing it more frequently,3,completer,84,neu,"{'language': 'en', 'score': 0.9999949387076638}",en,"{'neg': 0.0, 'neu': 1.0, 'pos': 0.0, 'compound': 0.0}",0.0,neu
707,2020-05-28,Only some sessions need improvement,4,completer,35,pos,"{'language': 'en', 'score': 0.9999950538918955}",en,"{'neg': 0.0, 'neu': 0.571, 'pos': 0.429, 'compound': 0.4588}",0.4588,pos
708,2020-05-26,A great introduction to the amazing resources one could use on IBM Watson Studio.,4,completer,81,pos,"{'language': 'en', 'score': 0.9999957139061147}",en,"{'neg': 0.0, 'neu': 0.582, 'pos': 0.418, 'compound': 0.836}",0.836,pos
709,2020-05-26,"This awesome course helps me to discover many data science tools. Its content fits for all attendants, including fans of open source tools, to employees of enterprises",4,completer,167,pos,"{'language': 'en', 'score': 0.9999965363601251}",en,"{'neg': 0.0, 'neu': 0.789, 'pos': 0.211, 'compound': 0.7717}",0.7717,pos
710,2020-05-26,the course is a brief introduction to the tools.,5,completer,48,pos,"{'language': 'en', 'score': 0.9999970288711415}",en,"{'neg': 0.0, 'neu': 1.0, 'pos': 0.0, 'compound': 0.0}",0.0,neu
711,2020-05-26,"Learn new open source data science tool like Jupyter notebook, R studio. good practical hands on Jupyter notebook.",4,completer,114,pos,"{'language': 'en', 'score': 0.9999953004854278}",en,"{'neg': 0.0, 'neu': 0.735, 'pos': 0.265, 'compound': 0.6597}",0.6597,pos
712,2020-05-26,great ,5,completer,6,pos,"{'language': 'ro', 'score': 0.999993435431341}",ro,"{'neg': 0.0, 'neu': 0.0, 'pos': 1.0, 'compound': 0.6249}",0.6249,pos
713,2020-05-26,The course felt very unstructured and the instructions were not explanatory.,2,completer,76,neg,"{'language': 'en', 'score': 0.9999980058389634}",en,"{'neg': 0.0, 'neu': 1.0, 'pos': 0.0, 'compound': 0.0}",0.0,neu
714,2020-05-26,great explanation of tools,5,completer,26,pos,"{'language': 'en', 'score': 0.9999963438845894}",en,"{'neg': 0.0, 'neu': 0.423, 'pos': 0.577, 'compound': 0.6249}",0.6249,pos
715,2020-05-26,Good course ,5,completer,12,pos,"{'language': 'en', 'score': 0.8571417061357522}",en,"{'neg': 0.0, 'neu': 0.256, 'pos': 0.744, 'compound': 0.4404}",0.4404,pos
716,2020-05-26,The Week 3 Watson Studio has video for the previous version - 'Data Science Experience'. I had difficuly in navigating through the Watson Studio.,4,completer,145,pos,"{'language': 'en', 'score': 0.9999972057417923}",en,"{'neg': 0.0, 'neu': 1.0, 'pos': 0.0, 'compound': 0.0}",0.0,neu
717,2020-05-25,I guess the videos shown are a bit outdated with regards with some of the tools ,4,completer,80,pos,"{'language': 'en', 'score': 0.9999995131210238}",en,"{'neg': 0.0, 'neu': 1.0, 'pos': 0.0, 'compound': 0.0}",0.0,neu
718,2020-05-25,Excellent explained,5,dropout,19,pos,"{'language': 'fr', 'score': 0.9999949318347887}",fr,"{'neg': 0.0, 'neu': 0.213, 'pos': 0.787, 'compound': 0.5719}",0.5719,pos
719,2020-05-25,Give me a good knowledge about tools we can use for data science.,5,completer,65,pos,"{'language': 'en', 'score': 0.9999959478482374}",en,"{'neg': 0.0, 'neu': 0.791, 'pos': 0.209, 'compound': 0.4404}",0.4404,pos
720,2020-05-25,"Unfortunatelly, the course materials are deprecated. The videos need to be reviewed. Also, there should be more videos and more content to work in the Notebooks. I think the course should be moved to a point where the student already knows some programming to be useful.",1,completer,270,neg,"{'language': 'en', 'score': 0.9999977395770817}",en,"{'neg': 0.0, 'neu': 0.937, 'pos': 0.063, 'compound': 0.4404}",0.4404,pos
721,2020-05-25,Good course for first steps of understending techniques of working with programs. But educational material is outdated. Most of the videos related to previouse version of learned systems. ,4,completer,188,pos,"{'language': 'en', 'score': 0.9999959589558124}",en,"{'neg': 0.0, 'neu': 0.903, 'pos': 0.097, 'compound': 0.4404}",0.4404,pos
722,2020-05-24,Basic knowledge of tools were to given for different analysis.,4,completer,62,pos,"{'language': 'en', 'score': 0.9999957158164028}",en,"{'neg': 0.0, 'neu': 1.0, 'pos': 0.0, 'compound': 0.0}",0.0,neu
723,2020-05-24,Wonderful!,5,completer,10,pos,"{'language': 'de', 'score': 0.5714256356138544}",de,"{'neg': 0.0, 'neu': 0.0, 'pos': 1.0, 'compound': 0.6114}",0.6114,pos
724,2020-05-24,VERY GOOD,5,completer,9,pos,"{'language': 'de', 'score': 0.9999955702649641}",de,"{'neg': 0.0, 'neu': 0.238, 'pos': 0.762, 'compound': 0.4927}",0.4927,pos
725,2020-05-24,"I enjoyed the course and think its really useful to understand the tools ahead of the core training, however the visuals and the hands-on are not in sync particularly so in Week 3",3,completer,179,neu,"{'language': 'en', 'score': 0.999998375703159}",en,"{'neg': 0.0, 'neu': 0.817, 'pos': 0.183, 'compound': 0.7574}",0.7574,pos
726,2020-05-23,Nicely made course. Great knowledge.,5,completer,36,pos,"{'language': 'en', 'score': 0.9999980394197792}",en,"{'neg': 0.0, 'neu': 0.3, 'pos': 0.7, 'compound': 0.7906}",0.7906,pos
727,2020-05-23,This course was just the marketing of IBM tools. I gained nothing expect the link which was in a discussion where I learned some basic python.,2,completer,142,neg,"{'language': 'en', 'score': 0.9999966082545126}",en,"{'neg': 0.0, 'neu': 0.894, 'pos': 0.106, 'compound': 0.3818}",0.3818,pos
