,date,review,rating,status,length,label,language_scores,language,scores,compound,sentiment
1357,2020-02-18,The IBM Data Studio videos are outdated and they don't reflect what you find on IBM Data Studio's new version. Please update the videos.,3,completer,136,neu,"{'language': 'en', 'score': 0.9999937428773}",en,"{'neg': 0.0, 'neu': 0.909, 'pos': 0.091, 'compound': 0.3182}",0.3182,pos
1358,2020-02-18,I was knowing about R and Jupyter note book and i was not knowing about the zepplien notebook.,5,completer,94,pos,"{'language': 'en', 'score': 0.9999960343939336}",en,"{'neg': 0.0, 'neu': 1.0, 'pos': 0.0, 'compound': 0.0}",0.0,neu
1359,2020-02-17,Good starting point for data science,4,completer,36,pos,"{'language': 'en', 'score': 0.7142834126146764}",en,"{'neg': 0.0, 'neu': 0.633, 'pos': 0.367, 'compound': 0.4404}",0.4404,pos
1360,2020-02-17,"This course introduces the learner to the open source tools for Data Science in a very efficient manner. It describes the usefulness of different  open source tools and at the same time provides hands on experience with them. There will be graded quiz sessions about each open source tool and it really helps to get the concepts clear. At the last, we have to write a Jupyter notebook and share it with our peers. We have been really guided very well to create our shareable notebook. Thanks for this course.",5,completer,508,pos,"{'language': 'en', 'score': 0.9999980533649454}",en,"{'neg': 0.0, 'neu': 0.793, 'pos': 0.207, 'compound': 0.9578}",0.9578,pos
1361,2020-02-17,The source tools demonstrated in this course have been updated and changed. The user must visit the forums to get more current information not provided by the course materials. ,3,completer,177,neu,"{'language': 'en', 'score': 0.9999969300776749}",en,"{'neg': 0.0, 'neu': 1.0, 'pos': 0.0, 'compound': 0.0}",0.0,neu
1362,2020-02-17,Please update videos base on new updated of Wastion Studio,3,completer,58,neu,"{'language': 'en', 'score': 0.9999968885876945}",en,"{'neg': 0.0, 'neu': 0.796, 'pos': 0.204, 'compound': 0.3182}",0.3182,pos
1363,2020-02-17,Good to start with the basics about the open-source tools which are ready to use for exploring the data science field.,5,completer,118,pos,"{'language': 'en', 'score': 0.9999967575255045}",en,"{'neg': 0.0, 'neu': 0.779, 'pos': 0.221, 'compound': 0.6597}",0.6597,pos
1364,2020-02-17,"This was my first time to get to know open-source data science tools and it gave me a general view of the same. of course, self-study is a must to get more familiar with these tools. ",5,completer,183,pos,"{'language': 'en', 'score': 0.9999973361763033}",en,"{'neg': 0.0, 'neu': 1.0, 'pos': 0.0, 'compound': 0.0}",0.0,neu
1365,2020-02-17,Introduces the sources used in Data Science in a very easy but applicable manner. ,5,completer,82,pos,"{'language': 'en', 'score': 0.9999970682247583}",en,"{'neg': 0.0, 'neu': 0.851, 'pos': 0.149, 'compound': 0.2724}",0.2724,pos
1366,2020-02-16,The course is pretty outdated,2,completer,29,neg,"{'language': 'en', 'score': 0.9999960224478096}",en,"{'neg': 0.0, 'neu': 0.556, 'pos': 0.444, 'compound': 0.4939}",0.4939,pos
1367,2020-02-16,Very well structured and delivered,5,completer,34,pos,"{'language': 'en', 'score': 0.9999946803051012}",en,"{'neg': 0.0, 'neu': 0.626, 'pos': 0.374, 'compound': 0.3384}",0.3384,pos
1368,2020-02-16,"Excellent, easy to follow very clear",5,completer,36,pos,"{'language': 'en', 'score': 0.9999969147709667}",en,"{'neg': 0.0, 'neu': 0.24, 'pos': 0.76, 'compound': 0.8588}",0.8588,pos
1369,2020-02-16,Materials were not updated and it was confusing to follow along.,3,completer,64,neu,"{'language': 'en', 'score': 0.9999972043682416}",en,"{'neg': 0.16, 'neu': 0.84, 'pos': 0.0, 'compound': -0.2263}",-0.2263,neg
1370,2020-02-16,It requires to register in different tools outside the coursera to proceed further.,3,completer,83,neu,"{'language': 'en', 'score': 0.9999981495981398}",en,"{'neg': 0.0, 'neu': 1.0, 'pos': 0.0, 'compound': 0.0}",0.0,neu
1371,2020-02-16,very good,5,completer,9,pos,"{'language': 'af', 'score': 0.9999957202307366}",af,"{'neg': 0.0, 'neu': 0.238, 'pos': 0.762, 'compound': 0.4927}",0.4927,pos
1372,2020-02-16,wounderfull,5,completer,11,pos,"{'language': 'en', 'score': 0.5714268504117486}",en,"{'neg': 0.0, 'neu': 1.0, 'pos': 0.0, 'compound': 0.0}",0.0,neu
1373,2020-02-16,I found the course helpful. The flow is also good,4,completer,49,pos,"{'language': 'en', 'score': 0.9999977122820799}",en,"{'neg': 0.0, 'neu': 0.551, 'pos': 0.449, 'compound': 0.6908}",0.6908,pos
1374,2020-02-16,This course is very helpful in understanding different types of Open sources platform regarding data science  and their feature,5,completer,127,pos,"{'language': 'en', 'score': 0.9999963128704802}",en,"{'neg': 0.0, 'neu': 0.853, 'pos': 0.147, 'compound': 0.4754}",0.4754,pos
1375,2020-02-16,  Wonderful course!  ,5,completer,21,pos,"{'language': 'en', 'score': 0.7142839739346474}",en,"{'neg': 0.0, 'neu': 0.2, 'pos': 0.8, 'compound': 0.6114}",0.6114,pos
1376,2020-02-15,The contents were not updated,3,completer,29,neu,"{'language': 'en', 'score': 0.9999972813945188}",en,"{'neg': 0.0, 'neu': 1.0, 'pos': 0.0, 'compound': 0.0}",0.0,neu
1377,2020-02-15,Introduction are well prepared,5,completer,30,pos,"{'language': 'en', 'score': 0.9999948860485337}",en,"{'neg': 0.0, 'neu': 0.333, 'pos': 0.667, 'compound': 0.4588}",0.4588,pos
1378,2020-02-15,Outdated Tutorials. Very Difficult to figure everything out. ,1,completer,61,neg,"{'language': 'en', 'score': 0.999997728782383}",en,"{'neg': 0.285, 'neu': 0.715, 'pos': 0.0, 'compound': -0.4201}",-0.4201,neg
1379,2020-02-15,I loved the practical approach of the course. It's not just listing of tools but step by step application which makes me more confident-I know exactly where to fetch each tool I need in a Data Science Project. Thank you.,5,completer,220,pos,"{'language': 'en', 'score': 0.9999970834311621}",en,"{'neg': 0.0, 'neu': 0.86, 'pos': 0.14, 'compound': 0.6908}",0.6908,pos
1380,2020-02-14,It's too useful step towards my career,5,completer,38,pos,"{'language': 'en', 'score': 0.9999960688766683}",en,"{'neg': 0.0, 'neu': 0.674, 'pos': 0.326, 'compound': 0.4404}",0.4404,pos
1381,2020-02-14,Its a very good informative course for different types of open source data science tool.,5,completer,88,pos,"{'language': 'en', 'score': 0.9999954987562626}",en,"{'neg': 0.0, 'neu': 0.803, 'pos': 0.197, 'compound': 0.4927}",0.4927,pos
1382,2020-02-14,"
Thank you very much for the excellent presentation of the material and the available intellectual tasks.

",5,completer,107,pos,"{'language': 'en', 'score': 0.9999965367811828}",en,"{'neg': 0.0, 'neu': 0.578, 'pos': 0.422, 'compound': 0.8591}",0.8591,pos
1383,2020-02-13,excellent course.!!,5,completer,19,pos,"{'language': 'fr', 'score': 0.9999953405784313}",fr,"{'neg': 0.0, 'neu': 0.189, 'pos': 0.811, 'compound': 0.6467}",0.6467,pos
1384,2020-02-13,Not updated Test are very novice ,1,completer,33,neg,"{'language': 'en', 'score': 0.9999967310901343}",en,"{'neg': 0.0, 'neu': 1.0, 'pos': 0.0, 'compound': 0.0}",0.0,neu
1385,2020-02-13,loved this course.this was quite an good experince,5,completer,50,pos,"{'language': 'en', 'score': 0.9999958967380855}",en,"{'neg': 0.0, 'neu': 0.459, 'pos': 0.541, 'compound': 0.7951}",0.7951,pos
1386,2020-02-12,Interesting course,5,completer,18,pos,"{'language': 'en', 'score': 0.9999932595719537}",en,"{'neg': 0.0, 'neu': 0.27, 'pos': 0.73, 'compound': 0.4019}",0.4019,pos
1387,2020-02-11,week 3 was very confusing as the video was severely out of date.,4,completer,64,pos,"{'language': 'en', 'score': 0.9999952262843143}",en,"{'neg': 0.342, 'neu': 0.658, 'pos': 0.0, 'compound': -0.6361}",-0.6361,neg
1388,2020-02-11,Really good program for learning truly useful open source tools for Data Science.,5,completer,81,pos,"{'language': 'en', 'score': 0.9999967430175605}",en,"{'neg': 0.0, 'neu': 0.527, 'pos': 0.473, 'compound': 0.8399}",0.8399,pos
1389,2020-02-11,"It would be helpful to have some extra videos explaining to explain more in detail functions in each of the programs. Apart from that, the content is quite good!",4,completer,161,pos,"{'language': 'en', 'score': 0.9999947208641258}",en,"{'neg': 0.0, 'neu': 0.811, 'pos': 0.189, 'compound': 0.7419}",0.7419,pos
1390,2020-02-11,"The course links are outdated, course provided online tools doesn't work properly i could not even access the lab environments mentioned in the course since there was issues with the website i simply cannot recommend the course based on that.",1,dropout,242,neg,"{'language': 'en', 'score': 0.9999990785171489}",en,"{'neg': 0.054, 'neu': 0.946, 'pos': 0.0, 'compound': -0.2755}",-0.2755,neg
1391,2020-02-10,Great course,5,completer,12,pos,"{'language': 'en', 'score': 0.999996204272928}",en,"{'neg': 0.0, 'neu': 0.196, 'pos': 0.804, 'compound': 0.6249}",0.6249,pos
1392,2020-02-10,The Watson Studio tutorial is out of date and the product itself is nothing but frustrating.  A bad experience. ,1,dropout,112,neg,"{'language': 'en', 'score': 0.9999989938624841}",en,"{'neg': 0.0, 'neu': 0.699, 'pos': 0.301, 'compound': 0.7835}",0.7835,pos
1393,2020-02-10,It was a great class ,5,completer,21,pos,"{'language': 'en', 'score': 0.9999973688767492}",en,"{'neg': 0.0, 'neu': 0.423, 'pos': 0.577, 'compound': 0.6249}",0.6249,pos
1394,2020-02-10,"It's a good course to know more about commons tools that might aid Data Scientists. However, it needs an update on the names and interfaces shown on the videos.",4,completer,160,pos,"{'language': 'en', 'score': 0.9999972647631783}",en,"{'neg': 0.0, 'neu': 0.903, 'pos': 0.097, 'compound': 0.4404}",0.4404,pos
1395,2020-02-10,fairly basic and simple,5,completer,23,pos,"{'language': 'en', 'score': 0.9999974120523835}",en,"{'neg': 0.0, 'neu': 1.0, 'pos': 0.0, 'compound': 0.0}",0.0,neu
1396,2020-02-09,"Not very well structured, sometimes outdated, sometimes with questions where the answer are only given at a later stage. ",2,completer,121,neg,"{'language': 'en', 'score': 0.9999977569899903}",en,"{'neg': 0.107, 'neu': 0.893, 'pos': 0.0, 'compound': -0.2572}",-0.2572,neg
1397,2020-02-09,Excellent,5,completer,9,pos,"{'language': 'ca', 'score': 0.9999935160918871}",ca,"{'neg': 0.0, 'neu': 0.0, 'pos': 1.0, 'compound': 0.5719}",0.5719,pos
1398,2020-02-08,Great Introduction to the Open Source Data Science Tools. But I would expect the tutorials to be easier to follow.,4,completer,114,pos,"{'language': 'en', 'score': 0.9999983451147307}",en,"{'neg': 0.0, 'neu': 0.711, 'pos': 0.289, 'compound': 0.7845}",0.7845,pos
1399,2020-02-08,It was fun and I really enjoyed learning through out the course!Thank You IBM & Coursera.,4,completer,89,pos,"{'language': 'en', 'score': 0.9999974900886308}",en,"{'neg': 0.0, 'neu': 0.625, 'pos': 0.375, 'compound': 0.8012}",0.8012,pos
1400,2020-02-08,IBM Watson has had many changes. The videos in this course when tackling this project does not match with the current IBM @Watson studio setting. ,4,completer,146,pos,"{'language': 'en', 'score': 0.9999976891017991}",en,"{'neg': 0.0, 'neu': 1.0, 'pos': 0.0, 'compound': 0.0}",0.0,neu
1401,2020-02-07,Great Experience,5,completer,16,pos,"{'language': 'ro', 'score': 0.9999950277527866}",ro,"{'neg': 0.0, 'neu': 0.196, 'pos': 0.804, 'compound': 0.6249}",0.6249,pos
1402,2020-02-07,"Marketing, not education.",1,dropout,25,neg,"{'language': 'en', 'score': 0.9999958433956921}",en,"{'neg': 0.0, 'neu': 1.0, 'pos': 0.0, 'compound': 0.0}",0.0,neu
1403,2020-02-06,I think that this course needs to be re-engineered. The videos are outdated and the videos jump right into the programming without explaining why you are typing out this code. It is not a course for beginners.,3,completer,209,neu,"{'language': 'en', 'score': 0.9999971396537662}",en,"{'neg': 0.0, 'neu': 1.0, 'pos': 0.0, 'compound': 0.0}",0.0,neu
1404,2020-02-06,"It was nice to get an overview of the tools, but I found the labs very simple. There didn't seem to be any important tasks to complete.",2,completer,135,neg,"{'language': 'en', 'score': 0.999998278302721}",en,"{'neg': 0.0, 'neu': 0.854, 'pos': 0.146, 'compound': 0.4767}",0.4767,pos
1405,2020-02-06,"Much of this was 5-star worthy, but a new video is desperately needed, as it does not match up with the current Watson environment and creates a lot of unnecessary confusion.",3,completer,174,neu,"{'language': 'en', 'score': 0.999996458794507}",en,"{'neg': 0.173, 'neu': 0.698, 'pos': 0.128, 'compound': -0.3818}",-0.3818,neg
1406,2020-02-06,Video content is a bit outdated so kindly update it or at least attach reading with it to let the students understand ,4,completer,118,pos,"{'language': 'en', 'score': 0.9999968004683085}",en,"{'neg': 0.0, 'neu': 0.829, 'pos': 0.171, 'compound': 0.6269}",0.6269,pos
1407,2020-02-06,NIice ,5,completer,6,pos,"{'language': 'ro', 'score': 0.9999933057438646}",ro,"{'neg': 0.0, 'neu': 1.0, 'pos': 0.0, 'compound': 0.0}",0.0,neu
1408,2020-02-06,Great course to get familiarized with the available tools for Data Science beginner.,5,completer,84,pos,"{'language': 'en', 'score': 0.999996946301128}",en,"{'neg': 0.0, 'neu': 0.745, 'pos': 0.255, 'compound': 0.6249}",0.6249,pos
1409,2020-02-05,This course was very helpful.,5,completer,29,pos,"{'language': 'en', 'score': 0.9999975697477048}",en,"{'neg': 0.0, 'neu': 0.564, 'pos': 0.436, 'compound': 0.4754}",0.4754,pos
1410,2020-02-05,Very informative!,4,completer,17,pos,"{'language': 'en', 'score': 0.999995481408497}",en,"{'neg': 0.0, 'neu': 1.0, 'pos': 0.0, 'compound': 0.0}",0.0,neu
1411,2020-02-05,"Outdated, mostly ads for the used services.You could learn all the information provided in this course in under half an hour just by reading.",1,completer,141,neg,"{'language': 'en', 'score': 0.9999972333018791}",en,"{'neg': 0.0, 'neu': 1.0, 'pos': 0.0, 'compound': 0.0}",0.0,neu
1412,2020-02-05,The videoes were not updated. I have spent hours to figure out how to follow the videos.,1,completer,88,neg,"{'language': 'en', 'score': 0.9999986983565055}",en,"{'neg': 0.0, 'neu': 1.0, 'pos': 0.0, 'compound': 0.0}",0.0,neu
1413,2020-02-05,Course was well laid out. Systematic and detailed. helps any new bie to Data Science. ,4,completer,86,pos,"{'language': 'en', 'score': 0.9999964800627167}",en,"{'neg': 0.0, 'neu': 0.734, 'pos': 0.266, 'compound': 0.5719}",0.5719,pos
1414,2020-02-05,Enjoyed this course. Great in understanding IBM cloud tools. ,5,completer,61,pos,"{'language': 'en', 'score': 0.9999975245602557}",en,"{'neg': 0.0, 'neu': 0.486, 'pos': 0.514, 'compound': 0.8126}",0.8126,pos
1415,2020-02-04,This course gave me the confidence that I can in fact learn about Data Science and excites me to learn even more!,5,completer,113,pos,"{'language': 'en', 'score': 0.9999964151790861}",en,"{'neg': 0.0, 'neu': 0.74, 'pos': 0.26, 'compound': 0.7712}",0.7712,pos
1416,2020-02-04,"The course was amazing, I was more than happy to find out that there are easy ways to perform the tasks of data science in environments that are ready and perfect and I'll definitely use them.Thanks a loT Coursera and IBM",4,completer,221,pos,"{'language': 'en', 'score': 0.9999973700995644}",en,"{'neg': 0.0, 'neu': 0.628, 'pos': 0.372, 'compound': 0.9616}",0.9616,pos
1417,2020-02-04,It's very helpful.,5,completer,18,pos,"{'language': 'en', 'score': 0.9999971862947049}",en,"{'neg': 0.0, 'neu': 0.393, 'pos': 0.607, 'compound': 0.4754}",0.4754,pos
1418,2020-02-04,"some videos/ articles are outdated. please update, especially watson studio's part.",4,completer,83,pos,"{'language': 'en', 'score': 0.9999962803406195}",en,"{'neg': 0.0, 'neu': 0.813, 'pos': 0.187, 'compound': 0.3182}",0.3182,pos
1419,2020-02-04,its okay,4,completer,8,pos,"{'language': 'fi', 'score': 0.7142842608803084}",fi,"{'neg': 0.0, 'neu': 0.345, 'pos': 0.655, 'compound': 0.2263}",0.2263,pos
1420,2020-02-04,the course was interesting with a lot to know but sometimes pages can't be loaded ,4,completer,82,pos,"{'language': 'en', 'score': 0.999996070182533}",en,"{'neg': 0.0, 'neu': 0.875, 'pos': 0.125, 'compound': 0.2144}",0.2144,pos
1421,2020-02-04,Update the videos before releasing this as a class,1,dropout,50,neg,"{'language': 'en', 'score': 0.9999975186266676}",en,"{'neg': 0.0, 'neu': 1.0, 'pos': 0.0, 'compound': 0.0}",0.0,neu
1422,2020-02-03,Splendid!,5,completer,9,pos,"{'language': 'af', 'score': 0.9999936775289817}",af,"{'neg': 0.0, 'neu': 0.0, 'pos': 1.0, 'compound': 0.6239}",0.6239,pos
1423,2020-02-03,ThanksNB: Videos need to be updated though,4,completer,42,pos,"{'language': 'en', 'score': 0.9999971816049082}",en,"{'neg': 0.0, 'neu': 1.0, 'pos': 0.0, 'compound': 0.0}",0.0,neu
1424,2020-02-03,Worth the time ,5,completer,15,pos,"{'language': 'en', 'score': 0.999999012299934}",en,"{'neg': 0.0, 'neu': 0.513, 'pos': 0.487, 'compound': 0.2263}",0.2263,pos
1425,2020-02-03,Enlightening course,5,completer,19,pos,"{'language': 'en', 'score': 0.9999956850290528}",en,"{'neg': 0.0, 'neu': 0.233, 'pos': 0.767, 'compound': 0.5106}",0.5106,pos
1426,2020-02-03,"The Data Science experience change to Watson studio is great. However, the videos and instructions need to be updated for clarity.",5,completer,130,pos,"{'language': 'en', 'score': 0.9999969158435671}",en,"{'neg': 0.0, 'neu': 0.736, 'pos': 0.264, 'compound': 0.7783}",0.7783,pos
1427,2020-02-03,Video regarding IBM watson need to be updated. ,2,dropout,47,neg,"{'language': 'en', 'score': 0.9999946641627905}",en,"{'neg': 0.0, 'neu': 1.0, 'pos': 0.0, 'compound': 0.0}",0.0,neu
1428,2020-02-02,"Great course, would love more work examples to improve my skills",4,completer,64,pos,"{'language': 'en', 'score': 0.9999961352439902}",en,"{'neg': 0.0, 'neu': 0.417, 'pos': 0.583, 'compound': 0.9042}",0.9042,pos
1429,2020-02-02,"It's a very practical course, giving me a direct access to the tools and languages used by Data Scientists all across the globe.",5,completer,128,pos,"{'language': 'en', 'score': 0.9999960352655162}",en,"{'neg': 0.0, 'neu': 0.882, 'pos': 0.118, 'compound': 0.3947}",0.3947,pos
1430,2020-02-02,Wonderfully Designed Course in the field Data Science.,5,completer,54,pos,"{'language': 'en', 'score': 0.9999953035467207}",en,"{'neg': 0.0, 'neu': 0.642, 'pos': 0.358, 'compound': 0.5994}",0.5994,pos
1431,2020-02-01,"The course is not really well organized. Furthermore, the videos are deprecated wrt the open sources they refer to. I wouldn't recommend it!",1,completer,140,neg,"{'language': 'en', 'score': 0.9999990665007366}",en,"{'neg': 0.181, 'neu': 0.819, 'pos': 0.0, 'compound': -0.5319}",-0.5319,neg
1432,2020-01-31,This course was very useful!,5,completer,28,pos,"{'language': 'en', 'score': 0.9999970273976413}",en,"{'neg': 0.0, 'neu': 0.534, 'pos': 0.466, 'compound': 0.54}",0.54,pos
1433,2020-01-31,"Even thought the course content is interesting, videos provided are not updated, making the learning experience a bit confusing",4,completer,127,pos,"{'language': 'en', 'score': 0.9999947159202842}",en,"{'neg': 0.092, 'neu': 0.777, 'pos': 0.131, 'compound': 0.2023}",0.2023,pos
1434,2020-01-31,Very interesting,5,completer,16,pos,"{'language': 'en', 'score': 0.7142827050634255}",en,"{'neg': 0.0, 'neu': 0.25, 'pos': 0.75, 'compound': 0.4576}",0.4576,pos
1435,2020-01-31,"Material seems outdated, and poorly informative. Too many topics are just mentioned without details, which is frustrating: I got the feeling that to have a minimal real understanding of the subject I had to do a lot of personal research outside of the course.",2,completer,259,neg,"{'language': 'en', 'score': 0.9999960457401538}",en,"{'neg': 0.068, 'neu': 0.896, 'pos': 0.035, 'compound': -0.34}",-0.34,neg
1436,2020-01-31,Awesome ,5,completer,8,pos,"{'language': 'af', 'score': 0.9999950767249097}",af,"{'neg': 0.0, 'neu': 0.0, 'pos': 1.0, 'compound': 0.6249}",0.6249,pos
1437,2020-01-31,"Please update the videos to reflect the updated IBM Watson studio's new look.Besides that, the course is solid!",3,completer,111,neu,"{'language': 'en', 'score': 0.9999971382745727}",en,"{'neg': 0.0, 'neu': 0.792, 'pos': 0.208, 'compound': 0.4926}",0.4926,pos
1438,2020-01-30," i have learn so many thing like  R studio,juypter and how to visulaize the data etc good course i have recommeneded so much for fresher",5,completer,136,pos,"{'language': 'en', 'score': 0.9999965257483642}",en,"{'neg': 0.0, 'neu': 0.779, 'pos': 0.221, 'compound': 0.6872}",0.6872,pos
1439,2020-01-30,"The instruction for the final assignment is totally outdated, it was a terrible experience. ",1,dropout,92,neg,"{'language': 'en', 'score': 0.9999980765548482}",en,"{'neg': 0.205, 'neu': 0.795, 'pos': 0.0, 'compound': -0.4767}",-0.4767,neg
1440,2020-01-30,The contents need to be updated,3,completer,31,neu,"{'language': 'en', 'score': 0.9999975089230603}",en,"{'neg': 0.0, 'neu': 1.0, 'pos': 0.0, 'compound': 0.0}",0.0,neu
1441,2020-01-30,This is a great course to learn critical Data science tool. ,4,dropout,60,pos,"{'language': 'en', 'score': 0.9999971056551583}",en,"{'neg': 0.16, 'neu': 0.556, 'pos': 0.285, 'compound': 0.4215}",0.4215,pos
1442,2020-01-30,Good course,5,completer,11,pos,"{'language': 'en', 'score': 0.9999962921963511}",en,"{'neg': 0.0, 'neu': 0.256, 'pos': 0.744, 'compound': 0.4404}",0.4404,pos
1443,2020-01-30,Good info. Nothing deep. Anticipating more.,5,completer,43,pos,"{'language': 'en', 'score': 0.9999974075303685}",en,"{'neg': 0.0, 'neu': 0.633, 'pos': 0.367, 'compound': 0.4404}",0.4404,pos
1444,2020-01-30,nice course,4,completer,11,pos,"{'language': 'fr', 'score': 0.9999920847824881}",fr,"{'neg': 0.0, 'neu': 0.263, 'pos': 0.737, 'compound': 0.4215}",0.4215,pos
1445,2020-01-29,Good for pointing you towards free open source tools to practice developing in for both Python and R. Also has a nice introduction of how to use some basic feature of these tools.,5,completer,179,pos,"{'language': 'en', 'score': 0.9999965321933643}",en,"{'neg': 0.0, 'neu': 0.763, 'pos': 0.237, 'compound': 0.8402}",0.8402,pos
1446,2020-01-29,Videos are out of data and the navigation is different from video to new software,3,completer,81,neu,"{'language': 'en', 'score': 0.9999958432457015}",en,"{'neg': 0.0, 'neu': 1.0, 'pos': 0.0, 'compound': 0.0}",0.0,neu
1447,2020-01-29,Gentle introduction to Watson Studio and skills lab,4,completer,51,pos,"{'language': 'en', 'score': 0.9999959447354803}",en,"{'neg': 0.0, 'neu': 0.707, 'pos': 0.293, 'compound': 0.4404}",0.4404,pos
1448,2020-01-29,Watson Studio part is a bit confusing and outdated.,4,completer,51,pos,"{'language': 'en', 'score': 0.9999972692627086}",en,"{'neg': 0.213, 'neu': 0.787, 'pos': 0.0, 'compound': -0.2263}",-0.2263,neg
1449,2020-01-29,Excelent course!,5,completer,16,pos,"{'language': 'fr', 'score': 0.9999960247605596}",fr,"{'neg': 0.0, 'neu': 1.0, 'pos': 0.0, 'compound': 0.0}",0.0,neu
1450,2020-01-29,Excellent course.,5,dropout,17,pos,"{'language': 'fr', 'score': 0.9999956279485014}",fr,"{'neg': 0.0, 'neu': 0.213, 'pos': 0.787, 'compound': 0.5719}",0.5719,pos
1451,2020-01-29,"This course was awful, just a bunch of useless speeches, limited or no information about the workbenches, explaining only how to save a file or how to upload a file - maybe 5-6 times I have heard instruction about saving your work. Who does not recognise save icon nowadays? Who needs these instructions? Only coding so far lear, 1 + 1 equal to 2.... Course 2 was just a waste of time.",1,dropout,385,neg,"{'language': 'en', 'score': 0.9999969371092045}",en,"{'neg': 0.175, 'neu': 0.739, 'pos': 0.086, 'compound': -0.6868}",-0.6868,neg
1452,2020-01-29,Really nice tools to learn how to use it!,5,dropout,41,pos,"{'language': 'en', 'score': 0.9999948804547674}",en,"{'neg': 0.0, 'neu': 0.703, 'pos': 0.297, 'compound': 0.5244}",0.5244,pos
1453,2020-01-29,"A bit boring, but necessary. I think there could be more graded exercises instead of  ungraded experiments. To make it more challenging.",3,dropout,136,neu,"{'language': 'en', 'score': 0.9999965105380139}",en,"{'neg': 0.075, 'neu': 0.819, 'pos': 0.106, 'compound': 0.1753}",0.1753,pos
1454,2020-01-29,There is a big gap in difficulty from course 1 to this course,3,completer,61,neu,"{'language': 'en', 'score': 0.9999971071673724}",en,"{'neg': 0.194, 'neu': 0.806, 'pos': 0.0, 'compound': -0.34}",-0.34,neg
1455,2020-01-28,the videos are of an older version,4,dropout,34,pos,"{'language': 'en', 'score': 0.9999986396386742}",en,"{'neg': 0.0, 'neu': 1.0, 'pos': 0.0, 'compound': 0.0}",0.0,neu
1456,2020-01-28,"Very good platform to learn Python, R, Jupyter, etc.",5,dropout,52,pos,"{'language': 'en', 'score': 0.999996269370646}",en,"{'neg': 0.0, 'neu': 0.715, 'pos': 0.285, 'compound': 0.4927}",0.4927,pos
1457,2020-01-28,Excellent!,5,completer,10,pos,"{'language': 'ca', 'score': 0.9999954162032307}",ca,"{'neg': 0.0, 'neu': 0.0, 'pos': 1.0, 'compound': 0.6114}",0.6114,pos
1458,2020-01-28,Good Starting for data science,5,completer,30,pos,"{'language': 'en', 'score': 0.9999948733235535}",en,"{'neg': 0.0, 'neu': 0.58, 'pos': 0.42, 'compound': 0.4404}",0.4404,pos
1459,2020-01-28,Good overview of all the available open source tools.,4,completer,53,pos,"{'language': 'en', 'score': 0.9999963709766889}",en,"{'neg': 0.0, 'neu': 0.734, 'pos': 0.266, 'compound': 0.4404}",0.4404,pos
1460,2020-01-28,"The course videos need updating. I, and other students, have wasted a lot of time trying to follow the out of date materials, not to mention the confusion and frustration that it creates. If the materials were kept up to date, I would have left a five-star review.",3,completer,264,neu,"{'language': 'en', 'score': 0.9999983136798274}",en,"{'neg': 0.165, 'neu': 0.795, 'pos': 0.041, 'compound': -0.7506}",-0.7506,neg
1461,2020-01-28,It's great,5,completer,10,pos,"{'language': 'en', 'score': 0.9999965665287446}",en,"{'neg': 0.0, 'neu': 0.196, 'pos': 0.804, 'compound': 0.6249}",0.6249,pos
1462,2020-01-28,Some of the videos where outdated ,4,completer,34,pos,"{'language': 'en', 'score': 0.9999974508082802}",en,"{'neg': 0.0, 'neu': 1.0, 'pos': 0.0, 'compound': 0.0}",0.0,neu
