,date,review,rating,status,length,label,language_scores,language,scores,compound,sentiment
0,2021-03-10,Some of the lab instructions are out of synch with the screenshots. Also some of the external sites references look and work differently then the screenshots or instructions. The section about the IBM tools is a huge dump of information that's somewhat confusing and doesn't appear very practical/usable to someone new to the field. The Git command line part looks very amateurish and is very hard to follow up by someone new to the subject. ,3,completer,442,neu,"{'language': 'en', 'score': 0.999997056713954}",en,"{'neg': 0.075, 'neu': 0.895, 'pos': 0.029, 'compound': -0.3818}",-0.3818,neg
1,2021-03-10,Very nice course. ,5,completer,18,pos,"{'language': 'en', 'score': 0.9999965592297603}",en,"{'neg': 0.0, 'neu': 0.393, 'pos': 0.607, 'compound': 0.4754}",0.4754,pos
2,2021-03-10,I have learned much knowledge about data science. And there are so many tools and programming languages to deal with it. They are useful and Intelligent and i  have more interest to join the data sicence world.,5,completer,210,pos,"{'language': 'en', 'score': 0.9999959027806586}",en,"{'neg': 0.0, 'neu': 0.727, 'pos': 0.273, 'compound': 0.8923}",0.8923,pos
3,2021-03-08,Clear Idea about the Data Science and its tools,5,completer,47,pos,"{'language': 'en', 'score': 0.9999971743061971}",en,"{'neg': 0.0, 'neu': 0.755, 'pos': 0.245, 'compound': 0.3818}",0.3818,pos
4,2021-03-08,"Nice overview, though the course materials have not been updated for more detailed navigation within IBM Cloud Pak for Data, in addition, in would be much  more convenient if in all of the videos there there would be possibility to save shorter specific notes at particular timestamps, there problems with the IBM Cloud Pak Lite subscription which has limited usage and one has to wait until the counter is updated in the beginning of the next month.",3,completer,450,neu,"{'language': 'en', 'score': 0.9999962557747355}",en,"{'neg': 0.055, 'neu': 0.873, 'pos': 0.072, 'compound': 0.34}",0.34,pos
5,2021-03-07,A great introductory course to learn entire ecosystem of tools used by data scientists,5,completer,86,pos,"{'language': 'en', 'score': 0.9999973606606977}",en,"{'neg': 0.0, 'neu': 0.745, 'pos': 0.255, 'compound': 0.6249}",0.6249,pos
6,2021-03-06,There were some parts. It's too much details about name of another package and brand name of it or something. Really difficult to digest it in a few hour. ,3,completer,155,neu,"{'language': 'en', 'score': 0.9999950418548255}",en,"{'neg': 0.094, 'neu': 0.906, 'pos': 0.0, 'compound': -0.4201}",-0.4201,neg
7,2021-03-05,"the first week is really impossible to follow, too many inofrmations and given too quickly and there's no meaning in listing all those programs. Second week is the best one in my view, and very well organized. About the last 2 weeks: a course on tools cannot be focused 50% on IBM tools, which, by the way, nobody uses.",2,completer,319,neg,"{'language': 'en', 'score': 0.9999971488825381}",en,"{'neg': 0.069, 'neu': 0.828, 'pos': 0.103, 'compound': 0.4954}",0.4954,pos
8,2021-03-05,some jargon difficult for newcomers to this field,4,completer,49,pos,"{'language': 'en', 'score': 0.9999965688204738}",en,"{'neg': 0.263, 'neu': 0.737, 'pos': 0.0, 'compound': -0.3612}",-0.3612,neg
9,2021-03-04,"Too basic info, and a whole host of shameless self-promotion. This course's usefulness is in 30 minutes of videos about Python, R, and SQL that give erroneous information and then followed by three weeks of discussing IBM tools. And you have to pay a subscription fee for the privilege of having a product sold to you. Disgusting.",1,completer,330,neg,"{'language': 'en', 'score': 0.9999979112756167}",en,"{'neg': 0.159, 'neu': 0.766, 'pos': 0.075, 'compound': -0.6486}",-0.6486,neg
10,2021-03-04,"Very simple and comprehensive introduction to Jupiter, Github and Watson Studio. To my mind the intro to Git and Github is one of the best in terms of quickly learning the tool.",4,completer,177,pos,"{'language': 'en', 'score': 0.9999960847022662}",en,"{'neg': 0.0, 'neu': 0.823, 'pos': 0.177, 'compound': 0.7553}",0.7553,pos
11,2021-03-02,Some updates are needed to ensure the video instructions tally with the particular website's content.,4,completer,101,pos,"{'language': 'en', 'score': 0.9999976411276488}",en,"{'neg': 0.0, 'neu': 0.843, 'pos': 0.157, 'compound': 0.3818}",0.3818,pos
12,2021-03-02,"Very patchy. Some of the videos were quite informative but the practical exercises were a real problem. Often the instructions were impossible to follow as the software must be a newer version than that shown in the instructions. I had to Google for the latest instructions. Also the practical exercises rarely told you *why* you were learning anything; it said ""type in this code"" but you didn't understand the code. I was able to finish the course but only through sheer perseverance (and Googling for instructions) - it was not enjoyable.",2,completer,541,neg,"{'language': 'en', 'score': 0.9999958699054043}",en,"{'neg': 0.073, 'neu': 0.927, 'pos': 0.0, 'compound': -0.769}",-0.769,neg
13,2021-03-01,Very well explained and support is great. Would recommend. ,4,completer,59,pos,"{'language': 'en', 'score': 0.99999714285263}",en,"{'neg': 0.0, 'neu': 0.3, 'pos': 0.7, 'compound': 0.8932}",0.8932,pos
14,2021-03-01,"A very gentle and slightly challenging introduction to the some of the best tools in the Data Science fraternity. Also, the added introduction to the IBM Watson Clouds tools was seriously interesting. Who knew you could just drag and drop files of refined data and you are on your way to ""Model Building""? ",5,completer,306,pos,"{'language': 'en', 'score': 0.99999662136635}",en,"{'neg': 0.092, 'neu': 0.725, 'pos': 0.184, 'compound': 0.7717}",0.7717,pos
15,2021-03-01,This course is very helpful,5,completer,27,pos,"{'language': 'en', 'score': 0.9999967190532255}",en,"{'neg': 0.0, 'neu': 0.564, 'pos': 0.436, 'compound': 0.4754}",0.4754,pos
16,2021-03-01,Amazing course,5,completer,14,pos,"{'language': 'en', 'score': 0.999995802926283}",en,"{'neg': 0.0, 'neu': 0.208, 'pos': 0.792, 'compound': 0.5859}",0.5859,pos
17,2021-02-28,Amazing explanation and awareness of different tools,5,completer,52,pos,"{'language': 'en', 'score': 0.9999972172995424}",en,"{'neg': 0.0, 'neu': 0.612, 'pos': 0.388, 'compound': 0.5859}",0.5859,pos
18,2021-02-27,"The flow is erratic, lot of random information not sure where to put it .. need to explain the process of what happens with data and why the apps are needed and what they do and how they help the process (work together) .. I heard about dozens of apps but have no clue when and if I would use them or why they are needed.  I am following the course but mostly having to research what you are saying .. the language is high level or sometimes overly complicated.  I only bring this up because this course said no prior experience needed there is not way a person having no IT experience will come away from these first 2 modules with an understanding",3,completer,649,neu,"{'language': 'en', 'score': 0.9999982992159914}",en,"{'neg': 0.079, 'neu': 0.906, 'pos': 0.015, 'compound': -0.7924}",-0.7924,neg
19,2021-02-27,"Excellent course. It gives you an overview of several data science tools and software. For each of them, a lab teaches you the basics and get you familiarized with the environment, user interface, and so on, without going too much into detail. It is up to the student to dig into more details if they so wish.A typical excellent class where it takes you a few hours to understand, but it could take you months or years to specialize in the tools if you wanted to.",5,completer,463,pos,"{'language': 'en', 'score': 0.9999961983303183}",en,"{'neg': 0.0, 'neu': 0.944, 'pos': 0.056, 'compound': 0.5902}",0.5902,pos
20,2021-02-26,good,4,completer,4,pos,"{'language': 'so', 'score': 0.9999967935365659}",so,"{'neg': 0.0, 'neu': 0.0, 'pos': 1.0, 'compound': 0.4404}",0.4404,pos
21,2021-02-26,I learned A LOT!!!!!,5,completer,20,pos,"{'language': 'en', 'score': 0.9999980686185188}",en,"{'neg': 0.0, 'neu': 1.0, 'pos': 0.0, 'compound': 0.0}",0.0,neu
22,2021-02-26,Great course! Superb presentations. ,5,completer,36,pos,"{'language': 'fr', 'score': 0.5714295545747544}",fr,"{'neg': 0.0, 'neu': 0.191, 'pos': 0.809, 'compound': 0.8588}",0.8588,pos
23,2021-02-25,"Too much theory, but practical exercises are easy. When telling about different software, it's very hard to remember all this information.",4,completer,138,pos,"{'language': 'en', 'score': 0.9999977920758678}",en,"{'neg': 0.082, 'neu': 0.763, 'pos': 0.155, 'compound': 0.4235}",0.4235,pos
24,2021-02-25,"Very brilliant, Thank you very much.",5,completer,36,pos,"{'language': 'en', 'score': 0.9999972080140918}",en,"{'neg': 0.0, 'neu': 0.368, 'pos': 0.632, 'compound': 0.7828}",0.7828,pos
25,2021-02-24,A lot of bugs. I'm very disappointed about this course. 24/7 hep is not existing!!,1,dropout,82,neg,"{'language': 'en', 'score': 0.9999965844112861}",en,"{'neg': 0.234, 'neu': 0.766, 'pos': 0.0, 'compound': -0.6094}",-0.6094,neg
26,2021-02-24,"This course is ""information overload"".  Personally I think that the structure can do with some tweaking.  The reason for this is because the information lacks context.  Week 1 and 2 were a bit daunting, but if you stick with it it does get better.It would help if there was a resources tab with summaries of the content discussed in the videos.  Also, when introducing the programming languages, they should say whether these languages are required.  I spent a lot of time downloading, installing, and trying to load the required libraries to do the assignments.  It was only later that I discovered that it is not necessary, and it is far quicker and more reliable to do these assignments in the free resources provided.Overall, not as bad as the other students make out in the comments, reviews and discussions.",3,completer,813,neu,"{'language': 'en', 'score': 0.9999960179602261}",en,"{'neg': 0.0, 'neu': 0.915, 'pos': 0.085, 'compound': 0.9149}",0.9149,pos
27,2021-02-22,Thank you! Course give the demanding skills in a modern hr-market.,5,completer,66,pos,"{'language': 'en', 'score': 0.8571393083317445}",en,"{'neg': 0.15, 'neu': 0.63, 'pos': 0.22, 'compound': 0.2244}",0.2244,pos
28,2021-02-21,"Poorly designed course.Week 1: While the first section was ok, after the section on
âData Science Toolsâ, it was more or less just a list of tools for data
science. I have 5 pages of notes that are mostly useless. The only reason I
wrote so much was that the quizzes often asked about such useless details, that
I learned to write more than I usually would. Whoever designed the course/tests
obviously has no real teaching experience. In addition, do not expect any
feedback from the quizzes. There is no attempt to help the learner learn from
wrong answers.The quality of most of the âinstructionâ was poor. The woman
reading the script often did not logically pause when a slide was changed or
more information was added to the slide, as if she didnât know what was on them.
For most of it, it was just a PowerPoint presentation. For IBM being so
advanced with technology, it seems for most of the teaching they simply used
20-year-old technology to demonstrate some of the most advanced technology that
currently exists. â¹ At
least they could have used a split screen to show a person AND text/screen
shots.Week 2: Better information. Same woman reading slidesâ¦who is
not convincing that she actually understood what she was actually reading.
However, the information was more useful and the tools introduced were better.
Now Iâm registered on some sites and weâll see how useful that is.Week 3: A big mix. Again lots of tools. Different people
speaking, but again they are just PowerPoint slides with no interaction with
people (unlike in the first course in the program). When there are screen captures,
sometimes they just jump and it is difficult to follow as they are quite quick.
Often the screen shots donât have high enough resolution, so many of the tabs
in the programs are either difficult or impossible to read, or they donât
capture the whole screen, so itâs pretty useless as we canât really follow how
it gets from one place to another.Sometimes poor English pronunciation. Why doesnât the person
who actually create the presentations/work with the programs actually do the
speaking?Week 4: Labs are useful and itâs great that there was some
kind of output. Unfortunately, many of the things that you have to do are not
actually taught in the course and you have to use other sources to find out how
to do things.",2,completer,2361,neg,"{'language': 'en', 'score': 0.9999968837201507}",en,"{'neg': 0.076, 'neu': 0.849, 'pos': 0.075, 'compound': 0.1248}",0.1248,pos
29,2021-02-20,Really ejoyed Labs and practical tasks.,4,completer,39,pos,"{'language': 'en', 'score': 0.9999979653573576}",en,"{'neg': 0.0, 'neu': 1.0, 'pos': 0.0, 'compound': 0.0}",0.0,neu
30,2021-02-20,"the course is design very well. In this short course, i learnt lot's of things and it's truly appreciable to all the content designer and teachers.",5,completer,147,pos,"{'language': 'en', 'score': 0.9999948254168893}",en,"{'neg': 0.0, 'neu': 0.813, 'pos': 0.187, 'compound': 0.6478}",0.6478,pos
31,2021-02-19,"Tools for data science is a well-designed, self-paced, intensive course that includes components of theory and practical exercises. I found the course both stimulating and challenging.  The ready availability of course materials helped me both to see and experiment with many open source and some proprietary tools. This course is an excellent way to prepare for further training as a data scientist.",5,completer,400,pos,"{'language': 'en', 'score': 0.9999950569303777}",en,"{'neg': 0.0, 'neu': 0.837, 'pos': 0.163, 'compound': 0.8658}",0.8658,pos
32,2021-02-18,Some of the instructions are not clear enough or beginners,3,completer,58,neu,"{'language': 'en', 'score': 0.9999972687223275}",en,"{'neg': 0.195, 'neu': 0.805, 'pos': 0.0, 'compound': -0.2924}",-0.2924,neg
33,2021-02-18,First two weeks had quite useful videos and labs. The third week was entirely about IBM which kind of feels like a shameless plug. Week 4 Assessment could have been made a bit harder,4,completer,182,pos,"{'language': 'en', 'score': 0.9999952304351553}",en,"{'neg': 0.066, 'neu': 0.776, 'pos': 0.158, 'compound': 0.5095}",0.5095,pos
34,2021-02-17,"Good course, very clear what to do. In week two might be too many tools presented.",4,completer,82,pos,"{'language': 'en', 'score': 0.9999976705739101}",en,"{'neg': 0.0, 'neu': 0.707, 'pos': 0.293, 'compound': 0.6997}",0.6997,pos
35,2021-02-17,Useful course with programs I wasn't familiar with. Class was laid out nicely for me to follow along and pass the assignments. Some of the interface was a little outdated compared to the slide show. Other than that well done.,4,completer,225,pos,"{'language': 'en', 'score': 0.999997158469133}",en,"{'neg': 0.0, 'neu': 0.816, 'pos': 0.184, 'compound': 0.7845}",0.7845,pos
36,2021-02-14,"While the general presentations were really good and had wonderful graphics, the explanations on other IBM tools were bit rushed and slightly overwhelming with its information.",4,completer,176,pos,"{'language': 'en', 'score': 0.9999975333146514}",en,"{'neg': 0.0, 'neu': 0.777, 'pos': 0.223, 'compound': 0.7841}",0.7841,pos
37,2021-02-14,It was a challenging course with some heavy usage of terminology. It took a little while to get my feet wet but the Lab sessions and reviewing content/videos helped and I was able to complete all my assignments succesfully.,4,completer,223,pos,"{'language': 'en', 'score': 0.9999961840764346}",en,"{'neg': 0.0, 'neu': 0.964, 'pos': 0.036, 'compound': 0.0772}",0.0772,pos
38,2021-02-14,"I gained a lot of valuable information with regard to the tools and scope of data science. With that, I now have more confidence in my data science profession.",5,completer,159,pos,"{'language': 'en', 'score': 0.9999972644998867}",en,"{'neg': 0.0, 'neu': 0.712, 'pos': 0.288, 'compound': 0.8516}",0.8516,pos
39,2021-02-13,Good introduction to data science tools.,5,completer,40,pos,"{'language': 'en', 'score': 0.9999956648139889}",en,"{'neg': 0.0, 'neu': 0.633, 'pos': 0.367, 'compound': 0.4404}",0.4404,pos
40,2021-02-13,"It is a very basic course, especially it is theoretical (something important to have a good foundation). Good course",4,completer,116,pos,"{'language': 'en', 'score': 0.9999979705895891}",en,"{'neg': 0.0, 'neu': 0.648, 'pos': 0.352, 'compound': 0.765}",0.765,pos
41,2021-02-13,This course is really great for a beginner who wants to develop their a career in Data Science.. ,4,completer,97,pos,"{'language': 'en', 'score': 0.9999964958580763}",en,"{'neg': 0.0, 'neu': 0.773, 'pos': 0.227, 'compound': 0.659}",0.659,pos
42,2021-02-13,"Informative, but feels like IBM advertisement.",4,completer,46,pos,"{'language': 'no', 'score': 0.8571360934194163}",no,"{'neg': 0.0, 'neu': 0.606, 'pos': 0.394, 'compound': 0.5023}",0.5023,pos
43,2021-02-13,Small parts of labs,3,completer,19,neu,"{'language': 'en', 'score': 0.9999977688205397}",en,"{'neg': 0.0, 'neu': 1.0, 'pos': 0.0, 'compound': 0.0}",0.0,neu
44,2021-02-12,A good course that introduces many aspects of data science by discussing open source tools that are consistently used in the field of data science. I like the IBM Watson Studio system that allows you to remotely run projects using various hardware and software environments. A lot of the tools discussed are IBM proprietary tools but they do discuss the theory and reason for using such tools. This is valuable to understand data science at a beginners level. All in all a good introductory course that helps fill in gaps of knowledge.,4,completer,535,pos,"{'language': 'en', 'score': 0.9999959345794596}",en,"{'neg': 0.0, 'neu': 0.844, 'pos': 0.156, 'compound': 0.9337}",0.9337,pos
45,2021-02-12,"Giving overall pictures of tools available for data scientist, great lectures ",5,completer,78,pos,"{'language': 'en', 'score': 0.9999948992427246}",en,"{'neg': 0.0, 'neu': 0.581, 'pos': 0.419, 'compound': 0.7579}",0.7579,pos
46,2021-02-11,"A course that specifically focusses on IBM products. Somehow i was able to navigate with the interface but sure it could have been better. But understandable, its part of certificate and that the course is from IBM. ",3,dropout,216,neu,"{'language': 'en', 'score': 0.9999946792440335}",en,"{'neg': 0.0, 'neu': 0.829, 'pos': 0.171, 'compound': 0.7783}",0.7783,pos
47,2021-02-09,Too much information thrown at you with little context. The final project didn't seem to have a lot to do with the information that we learned in the course. ,3,dropout,158,neu,"{'language': 'en', 'score': 0.9999974064161392}",en,"{'neg': 0.0, 'neu': 1.0, 'pos': 0.0, 'compound': 0.0}",0.0,neu
48,2021-02-09,"Overall great course - sometimes lectures were not very refined; I liked the final assignment, which required to research commands on Jupyter Notebook",4,completer,150,pos,"{'language': 'en', 'score': 0.9999959959476703}",en,"{'neg': 0.099, 'neu': 0.741, 'pos': 0.16, 'compound': 0.374}",0.374,pos
49,2021-02-08,good!,5,completer,5,pos,"{'language': 'so', 'score': 0.9999992425438513}",so,"{'neg': 0.0, 'neu': 0.0, 'pos': 1.0, 'compound': 0.4926}",0.4926,pos
50,2021-02-07,Getting an overview of all the tools available is very handy for dicussions with Data Scientists and for job applications!,5,completer,122,pos,"{'language': 'en', 'score': 0.9999969735024659}",en,"{'neg': 0.0, 'neu': 1.0, 'pos': 0.0, 'compound': 0.0}",0.0,neu
51,2021-02-06,A lot of information is thrown at you at once and really isn't explained other than that they are tools for data science. It would be easier to follow along if other random facts about them that aren't related to their purpose was removed. ,3,completer,240,neu,"{'language': 'en', 'score': 0.9999959442521731}",en,"{'neg': 0.0, 'neu': 0.938, 'pos': 0.062, 'compound': 0.4215}",0.4215,pos
52,2021-02-06,Lots of information!!! Excellent course.,5,completer,40,pos,"{'language': 'en', 'score': 0.9999965263818985}",en,"{'neg': 0.0, 'neu': 0.466, 'pos': 0.534, 'compound': 0.6784}",0.6784,pos
53,2021-02-05,"Since I do have a little knowledge of data science, I think the topics covered in this section (Tools for Data science) are valuable. However, I guess the way this course was taught as if students were comfortable with the field.",2,completer,229,neg,"{'language': 'en', 'score': 0.9999962148225721}",en,"{'neg': 0.0, 'neu': 0.845, 'pos': 0.155, 'compound': 0.7506}",0.7506,pos
54,2021-02-05,Well designed. Contents and Labs are truly rich. I would highly recommend it for those who would like to quickly enter this domain.,5,completer,131,pos,"{'language': 'en', 'score': 0.9999976288455631}",en,"{'neg': 0.0, 'neu': 0.55, 'pos': 0.45, 'compound': 0.9168}",0.9168,pos
55,2021-02-04,Good course.,5,dropout,12,pos,"{'language': 'en', 'score': 0.7142827020940814}",en,"{'neg': 0.0, 'neu': 0.256, 'pos': 0.744, 'compound': 0.4404}",0.4404,pos
56,2021-02-04,one of the best course I have ever taken,5,completer,40,pos,"{'language': 'en', 'score': 0.9999956399807366}",en,"{'neg': 0.0, 'neu': 0.625, 'pos': 0.375, 'compound': 0.6369}",0.6369,pos
57,2021-02-03,"This course is definitely packed with tons of information, and I learned a lot, but it really felt like it was like trying to learn to drive by reading the car's owners manual. They introduce the expansive languages and tools available to data scientists, but it lacks any practical context or too much hands on experience actually using the massive amount of functionalities that are presented. With that said, it is more of a pure rote memory type course rather than a practical, hands-on one. ",3,completer,496,neu,"{'language': 'en', 'score': 0.9999961270060013}",en,"{'neg': 0.0, 'neu': 0.895, 'pos': 0.105, 'compound': 0.8475}",0.8475,pos
58,2021-02-03,It was a really great course BUT in the labs the explanations on how to do things were very poor. I had to google a substantial amount,3,completer,134,neu,"{'language': 'en', 'score': 0.9999970969255518}",en,"{'neg': 0.151, 'neu': 0.689, 'pos': 0.161, 'compound': -0.1761}",-0.1761,neg
59,2021-02-02,"For a non IT person, it's workable and learn able as long as you focus. ",5,completer,72,pos,"{'language': 'en', 'score': 0.9999963124686277}",en,"{'neg': 0.0, 'neu': 1.0, 'pos': 0.0, 'compound': 0.0}",0.0,neu
60,2021-02-02,Enjoyed it ,5,completer,11,pos,"{'language': 'en', 'score': 0.8571396937345692}",en,"{'neg': 0.0, 'neu': 0.233, 'pos': 0.767, 'compound': 0.5106}",0.5106,pos
61,2021-01-31,"honestly, it was well taught. but the key problem was that the videos by mr. romeo kienzler were a bit advanced for my understanding as i had no prior experience of this and i tried to replicate the the things he was doing and couldnt understand at all what im supposed to do ahead of somewhere. mostly this problem was in Github and Rstudio",4,completer,341,pos,"{'language': 'en', 'score': 0.9999980537077895}",en,"{'neg': 0.142, 'neu': 0.786, 'pos': 0.072, 'compound': -0.7814}",-0.7814,neg
62,2021-01-31,Informative course: the course introduces Jupiter Notebook and R Studio. Good start to learn more about programming languages that are used in data science!,5,completer,156,pos,"{'language': 'en', 'score': 0.9999962399410554}",en,"{'neg': 0.0, 'neu': 0.873, 'pos': 0.127, 'compound': 0.4926}",0.4926,pos
63,2021-01-30,"There is a lot of description about IBM Watson tools and it's amazing at what one can do with those tools. It did feel a little overwhelming for a person like me (with zero knowledge about Data Science), but I guess it's going to be worth it.",4,completer,242,pos,"{'language': 'en', 'score': 0.9999959260987503}",en,"{'neg': 0.0, 'neu': 0.86, 'pos': 0.14, 'compound': 0.6705}",0.6705,pos
64,2021-01-29,"not recommended for a fresh data science, because many thing that's really odd for a new on this focus course, but i still recommended it because it still usefull. we can learn the jupyter notebook's work and github too, and i think it's really a good point in this course.",4,completer,273,pos,"{'language': 'en', 'score': 0.9999965940297384}",en,"{'neg': 0.127, 'neu': 0.788, 'pos': 0.085, 'compound': 0.2091}",0.2091,pos
65,2021-01-29,Great course.,5,completer,13,pos,"{'language': 'en', 'score': 0.9999962208933457}",en,"{'neg': 0.0, 'neu': 0.196, 'pos': 0.804, 'compound': 0.6249}",0.6249,pos
66,2021-01-28,A well coordinated and educative course on data science. Highly recommended for anyone with passion to learn and understand data science,5,completer,136,pos,"{'language': 'en', 'score': 0.9999945726482284}",en,"{'neg': 0.0, 'neu': 0.703, 'pos': 0.297, 'compound': 0.7346}",0.7346,pos
67,2021-01-28,This is supposed to be a course for beginners but the amount of advanced concepts and tools they throw at you with no explanation is staggering. A pity because otherwise this could be useful.,3,dropout,191,neu,"{'language': 'en', 'score': 0.999996521140857}",en,"{'neg': 0.14, 'neu': 0.701, 'pos': 0.159, 'compound': 0.1901}",0.1901,pos
68,2021-01-27,I loved getting to use some of these tools hands-on. Can't wait for future classes where we'll go more in depth.,5,completer,112,pos,"{'language': 'en', 'score': 0.9999966577653543}",en,"{'neg': 0.0, 'neu': 0.83, 'pos': 0.17, 'compound': 0.5994}",0.5994,pos
69,2021-01-27,Fun to learn about IBM Watson and its huge world of AI-stuff!,5,completer,61,pos,"{'language': 'en', 'score': 0.9999976019171621}",en,"{'neg': 0.0, 'neu': 0.629, 'pos': 0.371, 'compound': 0.7088}",0.7088,pos
70,2021-01-27,though excellent  teaching video need to be 1080p and some video needs to increase their volume .,5,completer,97,pos,"{'language': 'en', 'score': 0.9999954204567169}",en,"{'neg': 0.0, 'neu': 0.7, 'pos': 0.3, 'compound': 0.7184}",0.7184,pos
